"provincia","tipo/lugar","link","precio","caracteristicas","info","otros"
"Navarra","Piso en calle Navarro Villoslada, 23, 2º Ensanche, Pamplona/Iruña","https://www.idealista.com/venta-viviendas/navarra//inmueble/95974260/","338,000 €","3 hab. 130 m² Planta 2ª exterior con ascensor","Os presentamos este pisazo en pleno 2º Ensanche de Pamplona, con vistas, haciendo chaflán y siete huecos totalmente exteriores en una ubicación privilegiada, a un minuto de la Plaza de los Fueros y a","Negociable"
"Navarra","Piso en calle de Iñigo Arista, 1, Iturrama, Pamplona/Iruña","https://www.idealista.com/venta-viviendas/navarra//inmueble/99163009/","630,000 €","4 hab. 165 m² Planta 14ª exterior con ascensor","¿Alguna vez habías pensado tener la posibilidad de vivir en uno de los mejores edificios de Iturrama, en una última altura y completamente exterior? Sigue leyendo y descubrirás una vivienda excepciona","Lujo"
"Navarra","Chalet en calle Valle de Egüés, 12, 2º Ensanche, Pamplona/Iruña","https://www.idealista.com/venta-viviendas/navarra//inmueble/98433131/","950,000 €","4 hab. 200 m²","Te ofrezco una de las propiedades más exclusivas que vas a encontrar. Se trata de una villa pareada, haciendo esquina y situada en lo mejor del segundo ensanche, la Colonia Argaray. Una zona residenci","Luminoso"
"Navarra","Piso en Miguel Servet, San Jorge, Pamplona/Iruña","https://www.idealista.com/venta-viviendas/navarra//inmueble/101027474/","210,000 €","3 hab. 124 m² Planta 3ª exterior con ascensor","VENTA PISO CALLE MIGUEL SERVET ZONA NUEVA DE SAN JORGE. Consta de: Holl de entrada, Cocina acceso a Galeria cerrada, Salon Amplio gran ventanal. Habitacion Principal con vestidor, Habitacion a zona Ja",""
"Navarra","Piso en calle Paulino Caballero, 2º Ensanche, Pamplona/Iruña","https://www.idealista.com/venta-viviendas/navarra//inmueble/99128323/","560,000 €","6 hab. 248 m² Planta 5ª exterior con ascensor","VENTA DE PISO EN EL 2º ENSANCHE MUY LUMINOSO Y ALTO POSIBILIDAD DE GARAJE. Consta de: Holl recibidor con ropero, Cocina amplia y reformada con despensa. Salon con ventanal a Plaza Liberta y Comedor co",""
"Navarra","Piso en calle de Bartolomé de Carranza, Mendebaldea, Pamplona/Iruña","https://www.idealista.com/venta-viviendas/navarra//inmueble/101889824/","308,000 €","3 hab. 103 m² Planta 5ª exterior con ascensor","PISO EN VENTA EN SAN JUAN CERCA DE PARQUE YAMAYUCHI Y CINES GOLEN PAMPLONA. Consta de: Holl distribuidor, Amplia Cocina con ventana a la Plaza del Reloj. Salon grande con salida al balcon de la plaza",""
"Navarra","Piso en plaza Monasterios de Navarra, 3, San Juan, Pamplona/Iruña","https://www.idealista.com/venta-viviendas/navarra//inmueble/101812736/","165,000 €","3 hab. 74 m² Planta 5ª exterior con ascensor","Oportunidad muy interesante en San Juan. Vendemos piso en muy buen estado de conservación ubicado en Plaza Monasterios de Navarra, compuesto por 3 habitaciones (2 de ellas con armarios empotrados) con",""
"Navarra","Piso en calle Alfonso el Batallador, 7, Iturrama, Pamplona/Iruña","https://www.idealista.com/venta-viviendas/navarra//inmueble/101145854/","280,000 €","4 hab. 113 m² Planta 6ª exterior con ascensor","INMOBILIARIA SARASATE Extraordinaria y amplia vivienda en el barrio de Iturrama, con 4 dormitorios, 2 baños, salón, cocina y 2 terrazas, una interior y otra exterior. Situada en la sexta planta de la",""
"Navarra","Piso en calle Fermín Daoiz, Chantrea, Pamplona/Iruña","https://www.idealista.com/venta-viviendas/navarra//inmueble/99611340/","169,000 €","3 hab. 82 m² Planta 5ª exterior con ascensor","LA MILAGROSA INMOBILIARIA presenta a la Venta este Luminoso Piso en la mejor Zona de la Chantrea Ubicado en Orvina lll, este Luminoso Piso de orientación Suroeste muy luminoso, luz directa desde las 1",""
"Navarra","Piso en avenida de Sancho el Fuerte, 71, Iturrama, Pamplona/Iruña","https://www.idealista.com/venta-viviendas/navarra//inmueble/101548440/","366,000 €","3 hab. 144 m² Planta 5ª exterior con ascensor","Vendemos Fantástico piso en Torre Basoko en la avenida de Sancho el Fuerte 71 5ª altura con 113 metros distribuidos en 3 habtaciones, 2 baños, salón con balcón amplio y cocina con tendedero. La orient",""
"Navarra","Piso en plaza Juan XXIII, 1, San Juan, Pamplona/Iruña","https://www.idealista.com/venta-viviendas/navarra//inmueble/99946046/","698,000 €","5 hab. 196 m² exterior con ascensor","Bienvenido a este increíble piso de 196 m2 en Plaza Juan XXIII de San Juan. Uno de los mejores barrios junto al centro. Este impresionante inmueble se encuentra en la planta octava con bonitas vistas",""
"Navarra","Piso en avenida Conde Oliveto, 2º Ensanche, Pamplona/Iruña","https://www.idealista.com/venta-viviendas/navarra//inmueble/99259950/","370,000 €","2 hab. 119 m² Planta 1ª exterior con ascensor","Espectacular piso DE OBRA NUEVA A ESTRENAR en el 1º Ensanche junto a Príncipe de Viana, Corte Inglés y Vuelta del Castillo. ¡MÁGNIFICA TERRAZA de 25m2 PARA DISFRUTAR DE LOS DÍAS DE VERANO CON ORIENTAC",""
"Navarra","Piso en paseo de Pablo Sarasate Pasalekua, 38, Casco Antiguo, Pamplona/Iruña","https://www.idealista.com/venta-viviendas/navarra//inmueble/101890695/","625,000 €","5 hab. 225 m² Planta 8ª exterior con ascensor","A&P Inmobiliaria vende este señorial piso en pleno centro de Pamplona y en uno de los edificios más emblemáticos de la ciudad. Con una ubicación privilegiada. Al lado del Baluarte, a tres minutos anda",""
"Navarra","Ático en plaza de La Libertad, 2º Ensanche, Pamplona/Iruña","https://www.idealista.com/venta-viviendas/navarra//inmueble/86531658/","1,595,000 €","6 hab. 440 m² Planta 8ª exterior con ascensor","Siempre has deseado vivir en el corazón de Pamplona, en un emblemático edificio coronado por un espectacular ático, exclusivo y único por sus características... Pues como dice el viejo proverbio chino",""
"Navarra","Piso en calle Francisco Berlanga Robles, Lezkairu, Pamplona/Iruña","https://www.idealista.com/venta-viviendas/navarra//inmueble/101367484/","397,000 €","3 hab. 110 m² Planta 1ª con ascensor","VENTA O ALQUILER CON OPCIÓN A COMPRA! Lezkairu es el barrio de moda en estos momentos de la ciudad, su cercanía con el centro, sus servicios y la buena accesibilidad, lo hacer ser en estos momentos el",""
"Navarra","Piso en calle Yanguas y Miranda, 2º Ensanche, Pamplona/Iruña","https://www.idealista.com/venta-viviendas/navarra//inmueble/102125781/","695,000 €","5 hab. 193 m² Planta 7ª exterior con ascensor","Esta vivienda situada en la Calle Yanguas y Miranda, una de las direcciones más prestigiosas de Pamplona, ostenta un espléndido espacio de 193 metros cuadrados construidos. El entorno no podría ser má",""
"Navarra","Piso en plaza del Castillo, Casco Antiguo, Pamplona/Iruña","https://www.idealista.com/venta-viviendas/navarra//inmueble/102187907/","380,000 €","1 hab. 95 m² Planta 2ª exterior con ascensor","Vivienda en venta situada en Plaza del Castillo, en la plaza más emblemática del Casco Antiguo de Pamplona. La vivienda posee doble orientación, con un amplio mirador a Plaza del Castillo y un segundo",""
"Navarra","Piso en calle Paulino Caballero, 2º Ensanche, Pamplona/Iruña","https://www.idealista.com/venta-viviendas/navarra//inmueble/99916853/","560,000 €","6 hab. 248 m² Planta 5ª exterior con ascensor","La preciosa vivienda que aquí les presentamos se encuentra en el último tramo de Paulino Caballero con Plaza de la Libertad; ubicada en una quinta altura con orientación sur-oeste distribuye sus 220 m",""
"Navarra","Piso en avenida de Zaragoza, 2º Ensanche, Pamplona/Iruña","https://www.idealista.com/venta-viviendas/navarra//inmueble/100537482/","350,000 €","3 hab. 159 m² Planta 4ª exterior con ascensor","URBANTIA vende magnífico piso para reformar en el centro. Muy bien ubicado, entre la Plaza de Los Fueros y la Plaza Príncipe de Viana. Actualmente, la vivienda consta de vestíbulo, salón-comedor, coci",""
"Navarra","Piso en Monasterio de Zilbeti, San Juan, Pamplona/Iruña","https://www.idealista.com/venta-viviendas/navarra//inmueble/93982378/","345,000 €","3 hab. 131 m² Planta 6ª exterior con ascensor","A & P inmobiliaria vende excelente vivienda en zona principal del Barrio de San Juan. La casa tiene 118 metros útiles y se distribuye en salón doble, habitación principal con baño y vestidor, dos habi",""
"Navarra","Piso en calle de Tudela, 2º Ensanche, Pamplona/Iruña","https://www.idealista.com/venta-viviendas/navarra//inmueble/101625113/","318,000 €","3 hab. 130 m² Planta 5ª exterior con ascensor","Llevas tiempo buscando la oportunidad para vivir en el centro, pero son muy pocas las opciones que se ajustan a tus necesidades cuando lo quieres todo. Unas veces encuentras la ubicación ideal pero no",""
"Navarra","Piso en calle Monasterio de Aberin, San Juan, Pamplona/Iruña","https://www.idealista.com/venta-viviendas/navarra//inmueble/99823571/","380,000 €","4 hab. 145 m² Planta 3ª exterior con ascensor","A&P inmobiliaria vende en Pamplona, barrio de San Juan, una interesante vivienda para actualizar en una de las zonas mas comerciales. Dispone de cuatro habitaciones, 2 baños, salón con terraza y ampli",""
"Navarra","Piso en avenida del Conde Oliveto, 2º Ensanche, Pamplona/Iruña","https://www.idealista.com/venta-viviendas/navarra//inmueble/101074572/","370,000 €","2 hab. 118 m² Planta 1ª exterior con ascensor","Te interesa un lujoso y exclusivo piso de obra nueva, en un edificio completamente rehabilitado, en el primer ensanche de Pamplona? URBANTIA VENDE PISO DE OBRA NUEVA, DE 118 M2, EN EL CORAZÓN DE PAMPL",""
"Navarra","Piso en Olite, 2º Ensanche, Pamplona/Iruña","https://www.idealista.com/venta-viviendas/navarra//inmueble/99509638/","450,000 €","4 hab. 206 m² Planta 6ª exterior con ascensor","La vivienda que le presentamos se encuentra en el último tramo de la calle Olite: calle tranquila pero muy próxima, sin embargo, a todo: Colegios, Clubes deportivos, Centro Salud, Comercios, Supermerc",""
"Navarra","Piso en calle Yanguas y Miranda, 2º Ensanche, Pamplona/Iruña","https://www.idealista.com/venta-viviendas/navarra//inmueble/99277571/","845,000 €","5 hab. 282 m² Planta 8ª exterior con ascensor","Magnífica vivienda de 250 m2 y garaje en el centro y con las mejores vistas de Pamplona ¿Estás pensando en vivir en el centro, sin depender del coche y, al mismo tiempo, disfrutar de las mejores vista",""
"Navarra","Piso en calle de Francisco Bergamin Kalea, 45, 2º Ensanche, Pamplona/Iruña","https://www.idealista.com/venta-viviendas/navarra//inmueble/101404213/","440,000 €","4 hab. 183 m² Planta 7ª exterior con ascensor","Queremos presentarles un inmueble excepcional, situado en una de la zona más exclusivas de Pamplona-Iruña, la zona del 2 Ensanche. Este piso, ubicado en la séptima planta de un edificio construido en",""
"Navarra","Piso en avenida de Sancho el Fuerte, 61, Iturrama, Pamplona/Iruña","https://www.idealista.com/venta-viviendas/navarra//inmueble/101649923/","398,000 €","4 hab. 141 m² Planta 5ª exterior con ascensor","Os presentamos esta vivienda en la mejor zona de Iturrama, en la avenida de Sancho el fuerte, totalmente exterior.   Hace esquina, con orientación sur-oeste, norte-oeste. Lo que implica que tenga much",""
"Navarra","Piso en calle de Santa Engracia, 1, Buztintxuri, Pamplona/Iruña","https://www.idealista.com/venta-viviendas/navarra//inmueble/99930048/","126,000 €","2 hab. 64 m² Planta 2ª exterior sin ascensor","Si busca un piso en la Rochapea que esté recién reformado y listo para mudarse, no busque más.   La vivienda cuenta con una cocina  - salón  luminosos, una cocina totalmente equipada con electrodomést",""
"Navarra","Piso en plaza de La Libertad, 10, 2º Ensanche, Pamplona/Iruña","https://www.idealista.com/venta-viviendas/navarra//inmueble/101762691/","780,000 €","4 hab. 205 m² Planta 4ª exterior con ascensor","Sacamos a la venta esta amplia vivienda, totalmente reformada en Plaza de la Libertad. Sus 205 m2 construidos, se encuentran distribuidos en 4 dormitorios, todos ellos con armarios empotrados y el pri",""
"Navarra","Piso en calle Pedro Fernández Serrano, Lezkairu, Pamplona/Iruña","https://www.idealista.com/venta-viviendas/navarra//inmueble/100713301/","760,000 €","4 hab. 209 m² Planta 4ª exterior con ascensor","¿Cansado de buscar una vivienda lo suficientemente amplia y cómoda para toda la familia, en una ubicación privilegiada, una vivienda con materiales de máxima calidad que no tengas que reformar puesto",""
"Navarra","Piso en calle Estella, 1º Ensanche, Pamplona/Iruña","https://www.idealista.com/venta-viviendas/navarra/pagina-2.htm/inmueble/98004890/","425,000 €","3 hab. 110 m² Planta 5ª exterior con ascensor","Si buscas una vivienda especial en una buena zona. Si valoras los espacios amplios, la altura y tener mucha luz. Si para tí es importante la atención a los detalles. Si quieres algo reformado con las","Reformado"
"Navarra","Piso en calle Paulino Caballero, 42, 2º Ensanche, Pamplona/Iruña","https://www.idealista.com/venta-viviendas/navarra/pagina-2.htm/inmueble/98821951/","290,000 €","3 hab. 115 m² Planta 3ª exterior con ascensor","Estupendo piso de en el II ensanche,  para reformar con muchas posibilidades.","Con vistas"
"Navarra","Piso en calle de Irunlarrea, Mendebaldea, Pamplona/Iruña","https://www.idealista.com/venta-viviendas/navarra/pagina-2.htm/inmueble/101513221/","179,800 €","1 hab. 69 m² Planta 1ª exterior con ascensor","Bonito piso de un dormitorio en Mendebaldea, en la calle Irunlarrea. Barrio consolidado, con todos los servicios (supermercados, colegios, centros de salud, transporte público... ). Próximo al Complej",""
"Navarra","Ático en calle Felipe Gorriti, 35, 2º Ensanche, Pamplona/Iruña","https://www.idealista.com/venta-viviendas/navarra/pagina-2.htm/inmueble/102283267/","350,000 €","3 hab. 109 m² Planta 5ª exterior con ascensor","Este encantador ático con terraza en la calle Felipe Gorriti 35 de Pamplona ofrece una oportunidad única para vivir en un espacio luminoso y acogedor con comodidades modernas y una ubicación convenien",""
"Navarra","Dúplex en calle Ferrocarril, Buztintxuri, Pamplona/Iruña","https://www.idealista.com/venta-viviendas/navarra/pagina-2.htm/inmueble/102205329/","287,000 €","3 hab. 107 m² Planta 5ª con ascensor","ÁTICO DUPLEX.  Sumérgete en el lujo y la comodidad con este ático dúplex espectacularmente diseñado. Desde el momento en que entras, la vivienda te invita a relajarte y disfrutar de sus maravillosos e",""
"Navarra","Piso en avenida del Conde Oliveto, 1º Ensanche, Pamplona/Iruña","https://www.idealista.com/venta-viviendas/navarra/pagina-2.htm/inmueble/101078448/","370,000 €","2 hab. 119 m² Planta 1ª exterior con ascensor","Espectacular piso DE OBRA NUEVA A ESTRENAR en el 1º Ensanche junto a Príncipe de Viana, Corte Inglés y Vuelta del Castillo. ¡MÁGNIFICA TERRAZA de 25m2 PARA DISFRUTAR DE LOS DÍAS DE VERANO CON ORIENTAC",""
"Navarra","Piso en calle Sandoval, 3, 1º Ensanche, Pamplona/Iruña","https://www.idealista.com/venta-viviendas/navarra/pagina-2.htm/inmueble/100848289/","340,000 €","4 hab. 115 m² Planta 5ª con ascensor","¡Bienvenido a  este maravilloso piso en venta en el primer ensanche de Pamplona! Este inmueble cuenta con una ubicación privilegiada, ya que se encuentra junto a la Ciudadela de Pamplona, Baluarte y T",""
"Navarra","Piso en calle Nueva, 22, Casco Antiguo, Pamplona/Iruña","https://www.idealista.com/venta-viviendas/navarra/pagina-2.htm/inmueble/100533517/","178,000 €","1 hab. 76 m² Planta 2ª exterior sin ascensor","Este piso completamente amueblado de 62 m2 útiles, dispone de un amplio salón con dos balcones a la calle Nueva, desde donde se accede al dormitorio con armario empotrado, tiene una gran cocina-comedo",""
"Navarra","Piso en calle de Echarri Aranaz, 2, Chantrea, Pamplona/Iruña","https://www.idealista.com/venta-viviendas/navarra/pagina-2.htm/inmueble/100613771/","132,000 €","3 hab. 87 m² Planta 2ª exterior sin ascensor","¿Buscas un hogar acogedor en una zona tranquila y cerca de todo? Tenemos el piso perfecto para ti en el barrio de La Chantrea de Pamplona. Ubicado en la segunda planta sin ascensor, este piso de 87 me",""
"Navarra","Piso en travesía Vuelta del Castillo, 3, Iturrama, Pamplona/Iruña","https://www.idealista.com/venta-viviendas/navarra/pagina-2.htm/inmueble/101452748/","418,000 €","5 hab. 141 m² Planta 7ª exterior con ascensor","Estas buscando un piso amplio junto a los colegios de San Cernin y el Huerto? pues estas de suerte ya que ponemos a la venta este espectacular piso de 5 habitaciones, 2 baños, salón con balcón a calle",""
"Navarra","Piso en Echavacoiz, Pamplona/Iruña","https://www.idealista.com/venta-viviendas/navarra/pagina-2.htm/inmueble/101910353/","249,000 €","3 hab. 97 m² Planta 4ª exterior con ascensor","¡OPORTUNIDAD! Vivienda junto al Complejo Hospitalario, al comienzo de Echavacoiz Norte. Cuarta planta luminosa con vistas a la Avenida Pamplona. Dispone de salón comedor y amplia cocina. Tres dormitor",""
"Navarra","Piso en calle Cruz de Barkazio, 27, Rochapea, Pamplona/Iruña","https://www.idealista.com/venta-viviendas/navarra/pagina-2.htm/inmueble/102114271/","197,000 €","3 hab. 97 m² Planta 3ª exterior con ascensor","Consigue por fin tu casa en la Rochapea, al lado de las piscinas y zona deportiva. Cerca de Marcelo Celayeta y las líneas de autobúsy el comercio de todo tipo pero en una zona muy tranquila. Este comp",""
"Navarra","Piso en calle Serafín Olave, 25, Iturrama, Pamplona/Iruña","https://www.idealista.com/venta-viviendas/navarra/pagina-2.htm/inmueble/101258579/","269,000 €","3 hab. 100 m² Planta 2ª exterior con ascensor","Te enamorará su terraza de 14m2 pero este piso te ofrece mucho más. Situado en una ubicación privilegiada de Iturrama, Serafín Olave en el cruce con Fuente del Hierro, cerca de la vuelta del castillo,",""
"Navarra","Piso en calle de Irunlarrea, Mendebaldea, Pamplona/Iruña","https://www.idealista.com/venta-viviendas/navarra/pagina-2.htm/inmueble/99025009/","237,000 €","3 hab. 76 m² Planta 4ª con ascensor","En el demandado barrio de Mendebaldea, junto a la zona residencial de chalets, presentamos esta acogedora vivienda, luminosa y rodeada de todos los servicios. La vivienda consta de 3 dormitorios, saló",""
"Navarra","Piso en calle Tejería, Casco Antiguo, Pamplona/Iruña","https://www.idealista.com/venta-viviendas/navarra/pagina-2.htm/inmueble/101548645/","175,000 €","2 hab. 70 m² Planta 2ª exterior sin ascensor","Se vende una segunda altura en la calle Tejeria,  muy cerca a la calle Estafeta, Plaza de Toros y Plaza del Castillo. La vivienda esta distribuida en salón  comedor, dos dormitorios,  la habitación pr",""
"Navarra","Piso en avenida de Bayona, 30, San Juan, Pamplona/Iruña","https://www.idealista.com/venta-viviendas/navarra/pagina-2.htm/inmueble/100037875/","349,000 €","3 hab. 116 m² Planta 2ª exterior con ascensor","Una ubicación extraordinaria: En el cruce de Avda Bayona y Monasterio de Belate, con el mejor comercio, transporte, servicios y ocio de la zona. En un edificio rehabilitado, sin barreras arquitectónic",""
"Navarra","Piso en calle Barquilleros, 8, Casco Antiguo, Pamplona/Iruña","https://www.idealista.com/venta-viviendas/navarra/pagina-2.htm/inmueble/100830705/","149,900 €","3 hab. 56 m² Planta 3ª exterior sin ascensor","Se vende piso en la calle Barquilleros del casco antiguo de Pamplona junto al hotel Catedral. Es un 3º sin ascensor y esta distribuido en 3 habitaciones, salón, cocina y baño. Es ideal como inversión",""
"Navarra","Piso en avenida de Sancho El Fuerte, 49, Iturrama, Pamplona/Iruña","https://www.idealista.com/venta-viviendas/navarra/pagina-2.htm/inmueble/98698336/","376,900 €","3 hab. 117 m² exterior con ascensor","PRECIOSO Y LUMINOSO  piso en lo mejor de Iturrama. Tres hab. dos baños, garaje, trastero, terraza, vistas. Cocina independiente con lavadero y comedor. Buen estado y con muchas posibilidades de reform",""
"Navarra","Piso en calle de la Estafeta, 60, Casco Antiguo, Pamplona/Iruña","https://www.idealista.com/venta-viviendas/navarra/pagina-2.htm/inmueble/101952731/","320,000 €","1 hab. 63 m² Planta 3ª exterior con ascensor","Vivienda en venta a estrenar ubicada en Calle Estafeta 60-62, en el Casco Antiguo de Pamplona y situada en pleno recorrido del encierro de San Fermín. Prácticamente ya terminada la obra, puedes contac",""
"Navarra","Piso en calle Marqués de Rozalejo, 1º Ensanche, Pamplona/Iruña","https://www.idealista.com/venta-viviendas/navarra/pagina-2.htm/inmueble/100954820/","545,000 €","2 hab. 128 m² Planta 2ª exterior con ascensor","Se vende vivienda maravillosa, totalmente reformada, en Edificio emblemático, con una restauración única  ¡ Centro de Pamplona frente al Baluarte.  .  .",""
"Navarra","Piso en travesía de la Cendea de Iza, 5, Chantrea, Pamplona/Iruña","https://www.idealista.com/venta-viviendas/navarra/pagina-2.htm/inmueble/101828131/","164,000 €","4 hab. 87 m² Planta 2ª exterior con ascensor","¿Quieres vivir en la Txantrea? en el barrio se vive tan bien ¡que el que lo prueba no quiere vivir en otro sitio! Este estupendo piso que está junto a la avda Villava ( Y sus Villavesas) frente a Anso",""
"Navarra","Piso en Amaya, 2º Ensanche, Pamplona/Iruña","https://www.idealista.com/venta-viviendas/navarra/pagina-2.htm/inmueble/101396122/","395,000 €","4 hab. 131 m² Planta 5ª exterior con ascensor","A&P inmobiliaria vende vivienda en Pamplona, calle Amaya, zona de la parroquia de Cristo Rey. La vivienda tiene +/- 120 m² útiles y tiene una distribución de salón doble con salida a balcón, tres ampl",""
"Navarra","Piso en 2º Ensanche, Pamplona/Iruña","https://www.idealista.com/venta-viviendas/navarra/pagina-2.htm/inmueble/101954852/","470,000 €","3 hab. 167 m² Planta 5ª exterior con ascensor","EN VENTA EXTRAORDINARIO PISO EN YANGUAS Y MIRANDA VISTAS A LA CIUDADELA. PARQUE VUELTA DEL CASTILLO Y AUTOBUSES. Consta de: Amplio Holl entrada, Cocina completa con salida a un Balcon. Salon y Sala de",""
"Navarra","Piso en calle Paulino Caballero, 50, 2º Ensanche, Pamplona/Iruña","https://www.idealista.com/venta-viviendas/navarra/pagina-2.htm/inmueble/101097203/","515,000 €","5 hab. 215 m² Planta 2ª con ascensor","Cuando piensas en la vivienda de tus sueños, buscas una ubicación céntrica y a un paso de todos los servicios, un piso enorme con mucho espacio, 5 dormitorios, 3 baños, que esté reformada etc. Si adem",""
"Navarra","Ático en avenida Pamplona, Barañain","https://www.idealista.com/venta-viviendas/navarra/pagina-2.htm/inmueble/101261990/","245,000 €","1 hab. 64 m² Planta 7ª exterior con ascensor","¿TE GUSTA? ¡PUES LLAMA YA! , QUE TE LO QUITAN Bonito y acogedor Ático en Barañain, construido en 2002 sobre Avenida Pamplona, orientado al sur, con vistas espectaculares al monte, terraza de 21m² para",""
"Navarra","Piso en calle de San Esteban, Barañain","https://www.idealista.com/venta-viviendas/navarra/pagina-2.htm/inmueble/101549312/","158,500 €","3 hab. 78 m² Planta 14ª exterior con ascensor","Si busca un piso con muchísima luz y sol, última planta y vistas extraordinarias, ¡esta es su vivienda! Piso en Barañain de 78.78m² de superficie útil, hall, salón y tres dormitorios orientados al sur",""
"Navarra","Piso en calle Pedro Bidagor, Barañain","https://www.idealista.com/venta-viviendas/navarra/pagina-2.htm/inmueble/100700840/","236,000 €","4 hab. 110 m² Planta 11ª exterior con ascensor","Altura, luz, extraordinarias vistas y ¡ reformada! Estupenda vivienda en Barañain, junto a Avenida Pamplona, rodeada de Colegios, todo tipo de comercios, cerca del Centro de Salud, paradas de autobuse",""
"Navarra","Piso en calle de Tafalla, 32, 2º Ensanche, Pamplona/Iruña","https://www.idealista.com/venta-viviendas/navarra/pagina-2.htm/inmueble/99872833/","279,000 €","4 hab. 110 m² Planta 3ª exterior con ascensor","¿Quieres vivir en el Segundo Ensanche?   ¿quieres 4 habitaciones amplias? ¿no quieres pasillos interminables y lúgubres? ¿no quieres patios pequeños y oscuros? Tengo tu piso. De planta cuadrada, de gr",""
"Navarra","Piso en travesía Acella, 2, Iturrama, Pamplona/Iruña","https://www.idealista.com/venta-viviendas/navarra/pagina-2.htm/inmueble/98982962/","499,000 €","6 hab. 187 m² exterior con ascensor","PISO DIVISIBLE EN DOS, ¡ ¡ATENCION INVERSORES! , Travesia Acella, exclusiva vivienda en zona privilegiada de Pamplona, junto al parque de Yamaguchi, al lado de la Universidad de Navarra y la zona hosp",""
"Navarra","Casa o chalet independiente en avenida Navarra, Ayegui","https://www.idealista.com/venta-viviendas/navarra/pagina-2.htm/inmueble/82600162/","265,000 €","3 hab. 240 m²","INMOBILIARIA SARASATE PRESENTA: Unifamiliar aislado en Irache I, perfectamente cuidado y reformado, consta de planta baja y semisótano. En el semisótano está el txoko y el garaje, un baño, un lavadero",""
"Navarra","Piso en calle Amaya, 2º Ensanche, Pamplona/Iruña","https://www.idealista.com/venta-viviendas/navarra/pagina-3.htm/inmueble/101704433/","560,000 €","4 hab. 175 m² Planta 5ª exterior con ascensor","VENTA PISO CALLE AMAYA CENTRICO CERCA PLAZA DE TOROS. Consta de: Holl entrada, Cocina amplia con ventanas, Salon doble con ventanales a la calle. Amplio Comedor con ventanas a calle, 4 Habitaciones un",""
"Navarra","Piso en plaza Baja, 19, Corella","https://www.idealista.com/venta-viviendas/navarra/pagina-3.htm/inmueble/102144700/","79,900 €","3 hab. 99 m² Planta 1ª exterior sin ascensor","¡Oportunidad muy interesante en Corella! Vendemos piso en muy buen estado de conservación de 100 m2 construidos, distribuidos en 3 habitaciones (2 de ellas con armarios empotrados), 1 baño, cocina tot",""
