"provincia","tipo/lugar","link","precio","caracteristicas","info","otros"
"Navarra","Ático en avenida de Egüés, 56, Egüés","https://www.idealista.com/venta-viviendas/navarra/pagina-27.htm/inmueble/101579291/","364,900 €","2 hab. 124 m² Planta 3ª exterior con ascensor","Se vende este ático (última planta) en una de las zonas más exclusivas de la comarca, a tan solo 10 minutos de Pamplona. Este Ático está ubicado en Gorraiz Norte, con unas vistas dignas de disfrutar,",""
"Navarra","Casa o chalet independiente en avenida Monasterio, Ayegui","https://www.idealista.com/venta-viviendas/navarra/pagina-27.htm/inmueble/91734673/","320,000 €","4 hab. 280 m²","INMOBILIARIA SARASATE. Buscas un hogar para tu familia? Aquí te presentamos esta preciosa casa en zona residencial. Se trata de una estupenda finca de 1500 m2 con una vivienda muy cómoda y espaciosa e",""
"Navarra","Dúplex en calle la rua, Estella","https://www.idealista.com/venta-viviendas/navarra/pagina-27.htm/inmueble/101766188/","99,000 €","1 hab. 87 m² Planta 2ª exterior sin ascensor","Inmobiliaria Sarasate de Estella-Lizarra presenta; Triplex para entrar a vivir en la calle La Rua de Estella-Lizarra, una de las calle mas emblemáticas de la ciudad. Calle por donde discurre el Camino",""
"Navarra","Piso en calle María Lacunza, 6, Lezkairu, Pamplona/Iruña","https://www.idealista.com/venta-viviendas/navarra/pagina-27.htm/inmueble/102125472/","379,000 €","3 hab. 109 m² Bajo exterior con ascensor","A&P Inmobiliaria ofrece en venta este precioso bajo con jardín, garaje y trastero incluidos en el precio, en la mejor zona de Lezkairu. En la calle María Lacunza, paralela a la Avenida de Cataluña se",""
"Navarra","Piso en Urbanización San Juan, 3, Corella","https://www.idealista.com/venta-viviendas/navarra/pagina-27.htm/inmueble/98545300/","225,000 €","4 hab. 138 m² Planta 1ª exterior con ascensor","Se le conoce por su potente industria, por su buen vino y por supuesto, por su pasión por muchos deportes, ¿Sabes de qué municipio estamos hablando? Efectivamente, Corella. Y precisamente en este bucó",""
"Navarra","Ático en plaza Lakuondo, 2, Lezkairu, Pamplona/Iruña","https://www.idealista.com/venta-viviendas/navarra/pagina-27.htm/inmueble/102155338/","750,000 €","4 hab. 161 m² Planta 8ª exterior con ascensor","¿Estás buscando un ático que cumpla tus estándares de vida? Entonces ya lo has encontrado: este impresionante ático de 4 habitaciones y 2 baños en LEZKAIRU (Mutilva) es lo que necesitas. Ubicado en la",""
"Navarra","Ático en plaza Felisa Munárriz, s/n, Milagrosa, Pamplona/Iruña","https://www.idealista.com/venta-viviendas/navarra/pagina-27.htm/inmueble/100903764/","595,000 €","3 hab. 147 m² exterior con ascensor","Última oportunidad: ¡Programa cita para visitar tu futura vivienda! Plaza Felisa es un proyecto exclusivo de 19 viviendas de obra nueva en Pamplona, estratégicamente situado en Plaza Felisa Munarriz,",""
"Navarra","Piso en calle Fermín Tirapu, 7, Villava","https://www.idealista.com/venta-viviendas/navarra/pagina-27.htm/inmueble/101768185/","293,000 €","2 hab. 77 m² Planta 9ª exterior con ascensor","Cuando pensamos en desconectar del ritmo diario a veces sólo se nos ocurre escapar de nuestra ciudad, pero con el ático que te vamos a mostrar, llegar a casa cada día es como una huida al mejor de los",""
"Navarra","Chalet adosado en calle De Maillata, Olite","https://www.idealista.com/venta-viviendas/navarra/pagina-27.htm/inmueble/100295160/","200,000 €","3 hab. 212 m²","VIVIENDA UNIFAMILIAR ADOSADA de dos plantas con 212m2 construidos y 190m2 útiles con TERRAZA de 40m2 en Olite, Navarra. PLANTA BAJA La planta baja de 95m2 útiles dispone de amplio portal de entrada o",""
"Navarra","Casa rural en calle Alta, Ituren","https://www.idealista.com/venta-viviendas/navarra/pagina-27.htm/inmueble/95471876/","390,000 €","9 hab. 450 m²","Precioso caserío localizado en uno de los pueblos más bonitos del norte de Navarra, más concretamente en Ituren, en el valle de Santesteban. La vivienda consta de 4 plantas y se distribuyen de la sigu",""
"Navarra","Casa de pueblo en calle Norte, Artazu","https://www.idealista.com/venta-viviendas/navarra/pagina-27.htm/inmueble/99436350/","315,000 €","4 hab. 301 m²","Atención inversores: ¡se vende extraordinaria casa de pueblo! La vivienda está actualmente dirigida al turismo rural. Se le puede dar uso tanto para vivienda particular como inversión. La casa está re",""
"Navarra","Piso en paseo de santa lucia, Buztintxuri, Pamplona/Iruña","https://www.idealista.com/venta-viviendas/navarra/pagina-27.htm/inmueble/102340551/","176,940 €","3 hab. 101 m² Planta 1ª exterior con ascensor","¡ VIVIENDA ESPECIAL! Es un inmueble de VPO muy cuidado que se encuentra en el barrio de Buztintxuri a escasos minutos del centro de la Pamplona. En sus alrededores encontramos panadería, farmacia, col",""
"Navarra","Casa o chalet independiente en nabaz, Lesaka","https://www.idealista.com/venta-viviendas/navarra/pagina-27.htm/inmueble/97493084/","450,000 €","3 hab. 330 m²","CASA CON ENCANTO EN LESAKA Se vende casa independiente en parcela de 1505m2 en el barrio de Nabaz de Lesaka, Navarra. Vivienda con estructura mixta (hormigón y madera) de reciente construcción en muy",""
"Navarra","Piso en calle Doctor Fleming, San Jorge, Pamplona/Iruña","https://www.idealista.com/venta-viviendas/navarra/pagina-27.htm/inmueble/96990951/","185,000 €","2 hab. 79 m² Planta 1ª exterior con ascensor","PISO EN VENTA CALLE DOCTOR FLEMING CON GARAJE Y TRASTERO. Consta de: Cocina, Salon de 20m2, 2 Habitaciones, 2 Baños uno con bañera y otro con ducha. Garaje y trastero. Muy buenas vistas y muy soleado.",""
"Navarra","Piso en Santa Cruz, 41, Zizur Mayor/Zizur Nagusia","https://www.idealista.com/venta-viviendas/navarra/pagina-27.htm/inmueble/102230831/","159,000 €","3 hab. 103 m² Planta 2ª exterior con ascensor","Piso completamente exterior con tres dormitorios y un baño. Dispone de una plaza de garaje incluida en el precio.",""
"Navarra","Casa o chalet independiente en Larraun","https://www.idealista.com/venta-viviendas/navarra/pagina-27.htm/inmueble/102103190/","490,000 €","5 hab. 834 m²","Casa independiente en Iribas, Valle de Larraun, Navarra. La finca total tiene una superficie de 636 m², de los cuales la edificación ocupa 326m2. El resto de la superficie sin edificar tiene 310 m2 y",""
"Navarra","Piso en plaza de los fueros, 3, Barañain","https://www.idealista.com/venta-viviendas/navarra/pagina-27.htm/inmueble/100405979/","229,900 €","4 hab. 125 m² Planta 7ª exterior con ascensor","¿Necesitas un piso qué sea cómo un lienzo en blanco donde establecer y construir un hogar en Barañáin? Te presentamos esta amplia y espaciosa vivienda de 112 m² construidos, situada en una 7ª altura,",""
"Navarra","Dúplex en Tablada, 16, Zizur Mayor/Zizur Nagusia","https://www.idealista.com/venta-viviendas/navarra/pagina-27.htm/inmueble/101353584/","349,900 €","4 hab. 180 m² Planta 2ª exterior con ascensor","Nan Bei & Pou presenta este ESPECTACULAR ÁTICO-DUPLEX en la mejor zona residencial de Zizur Mayor. La vivienda tiene solo un año de uso. En la primera planta nos encontramos con un gran salón, cocina",""
"Navarra","Ático en plaza lakuondo, 2, Lezkairu, Pamplona/Iruña","https://www.idealista.com/venta-viviendas/navarra/pagina-27.htm/inmueble/101032233/","679,500 €","3 hab. 150 m² Planta 8ª exterior con ascensor","¿Estás buscando un ático que cumpla tus estándares de vida? Entonces ya lo has encontrado: este impresionante ático de 3 habitaciones en LEZKAIRU (Mutilva) es lo que necesitas. ¡Prácticamente, a estre",""
"Navarra","Chalet adosado en avenida de Egüés, 95, Egüés","https://www.idealista.com/venta-viviendas/navarra/pagina-27.htm/inmueble/101546347/","499,900 €","4 hab. 268 m²","Te presentamos este chalet adosado en GORRAIZ en una de las zonas más exclusivas de la comarca, a tan solo 10 minutos de Pamplona, podrás disfrutar de la tranquilidad de una zona residencial. La promo",""
"Navarra","Piso en calle Basilio Armendáriz, 18, Burlada","https://www.idealista.com/venta-viviendas/navarra/pagina-27.htm/inmueble/100518205/","120,000 €","2 hab. 71 m² Planta 4ª exterior con ascensor","Se vende luminoso piso para reformar en el centro de Burlada, calle Basilio Armendáriz, junto al Ayuntamiento y al Parque Uranga. ¡Sí está buscando una vivienda confortable para ponerla a su gusto, no",""
"Navarra","Piso en paseo de Pablo Sarasate Pasalekua, Pamplona, 22, Casco Antiguo, Pamplona/Iruña","https://www.idealista.com/venta-viviendas/navarra/pagina-27.htm/inmueble/82583720/","570,000 €","3 hab. 138 m² Planta 4ª exterior con ascensor","Precioso piso luminoso de 110 m2 útiles, trastero y garaje de reciente construcción, en el centro de Pamplona, en pleno Paseo Sarasate, al lado de la Plaza del Castillo. Posee 3 habitaciones y 2 baños",""
"Navarra","Piso en plaza del Castillo, 18, Casco Antiguo, Pamplona/Iruña","https://www.idealista.com/venta-viviendas/navarra/pagina-27.htm/inmueble/82784558/","480,000 €","3 hab. 104 m² Planta 3ª exterior con ascensor","Nos encontramos en el Antiguo Hotel Quintana, Edificio totalmente rehabilitado, encima del Tropicana, junto al Nuevo Casino y el Txoko, en la Plaza del Castillo. El edificio dispone, actualmente, de u",""
"Navarra","Piso en plaza Doctor Ortiz de Landázuri, 11, San Jorge, Pamplona/Iruña","https://www.idealista.com/venta-viviendas/navarra/pagina-27.htm/inmueble/98428713/","224,900 €","4 hab. 104 m² Planta 1ª exterior con ascensor","¡Haznos una oferta, te escuchamos! ¿Buscas tu hogar a escasos minutos del centro de Pamplona? ¿En una zona relativamente nueva? ¿Y… a un precio justo de mercado? ¡No es misión imposible! Te invitamos",""
"Navarra","Piso en avenida de Severino Fernandez Ibilbidea, 40, Tafalla","https://www.idealista.com/venta-viviendas/navarra/pagina-28.htm/inmueble/97263654/","235,000 €","4 hab. 256 m² Planta 8ª exterior con ascensor","SE VENDE ESPECTACULAR PISO en la Avenida Severino Fernández, una de las arterias más importantes y céntricas de Tafalla, frente al Paseo Padre Calatayud y a 100 metros de la Plaza Francisco de Navarra",""
"Navarra","Piso en paseo de Pablo Sarasate Pasalekua, Pamplona, 22, Casco Antiguo, Pamplona/Iruña","https://www.idealista.com/venta-viviendas/navarra/pagina-28.htm/inmueble/82583720/","570,000 €","3 hab. 138 m² Planta 4ª exterior con ascensor","Precioso piso luminoso de 110 m2 útiles, trastero y garaje de reciente construcción, en el centro de Pamplona, en pleno Paseo Sarasate, al lado de la Plaza del Castillo. Posee 3 habitaciones y 2 baños",""
"Navarra","Casa o chalet independiente en San Esteban, 29, Noáin (Valle de Elorz)","https://www.idealista.com/venta-viviendas/navarra/pagina-28.htm/inmueble/100801341/","385,000 €","3 hab. 193 m²","¡FABULOSA OPORTUNIDAD¡ ¡Mejor precio de la zona! Se vende magnífico chalet independiente en la localidad de Zulueta (Valle de Elorz), a 5 minutos de Pamplona. Entorno residencial, muy tranquilo, en un",""
"Navarra","Chalet en calle Cantera, Sesma","https://www.idealista.com/venta-viviendas/navarra/pagina-28.htm/inmueble/101206026/","86,000 €","3 hab. 123 m²","Preciosa casa reformada en Sesma, muy bien ubicada de 3 alturas. Perfecta para entrar a vivir o disfrutarla los fines de semana CON CEDULA DE HABITABILIDAD con una superficie de 41 mt2 esta casa lo ti",""
"Navarra","Casa de pueblo en Emilio Arrieta, 6, Puente la Reina","https://www.idealista.com/venta-viviendas/navarra/pagina-28.htm/inmueble/95303209/","240,000 €","4 hab. 210 m²","Disponible en venta casa adosada en el centro de Puente la Reina. Se distribuye en 3 plantas más entrecubierta diáfana. En planta baja se encuentra un txoko con cocina y aseo,  despensa y sala de cald",""
"Navarra","Chalet adosado en calle nueva, 9, Arroniz","https://www.idealista.com/venta-viviendas/navarra/pagina-28.htm/inmueble/98251511/","77,000 €","4 hab. 155 m²","En el pueblo de Arroniz, situado en la Merindad de Estella a tan solo 55 km de Pamplona, se vende esta casa, que en su ultima planta tiene una gran terraza con unas bonitas vistas. La casa esta distri",""
"Navarra","Chalet adosado en camino Euntzea, 60, Aoiz","https://www.idealista.com/venta-viviendas/navarra/pagina-28.htm/inmueble/102097628/","230,000 €","4 hab. 188 m²","¿Cuantas veces soñamos con despertarnos con toda tranquilidad como si estuviéramos de vacaciones? Muchas ¿verdad? Y ver como la luz del sol baña toda la casa mientras persigues ese olor a café que vie",""
"Navarra","Casa o chalet independiente en avenida Navarra, Ayegui","https://www.idealista.com/venta-viviendas/navarra/pagina-28.htm/inmueble/100918561/","380,000 €","4 hab. 166 m²","ACTUALMENTE ALQUILADA Y RENTANDO ¿Quieres vivir rodeado de naturaleza, pero cerca de la ciudad? Chalet Independiente en parcela de 765mt2 en venta en Irache. Casa muy bien cuidada con piscina de 30 mt",""
"Navarra","Piso en San Isidro, Burlada","https://www.idealista.com/venta-viviendas/navarra/pagina-28.htm/inmueble/99821121/","149,000 €","4 hab. 100 m² Planta 3ª exterior con ascensor","Todo es cuestion de CONFIANZA. Piso en venta en el centro de Burlada muy luminoso y balcon. Consta de Cocina, Salon, 4 Habitaciones, 1 Baño, Ascensor Nuevo. Zona con todos los servicios y cerca del ce",""
"Navarra","Piso en plaza Juan XXIII, 1, San Juan, Pamplona/Iruña","https://www.idealista.com/venta-viviendas/navarra/pagina-28.htm/inmueble/100442872/","595,000 €","5 hab. 196 m² Planta 4ª exterior con ascensor","VIVE EN UNO DE LOS MEJORES EDIFICIOS DEL PAMPLONA  ¿Eres de los que no se conforman con cualquier cosa? Entonces imagina vivir en la casa de tus sueños en el edificio Larrainalde, al lado de la torre",""
"Navarra","Chalet adosado en avenida Concejo de Iza, 36, Iza","https://www.idealista.com/venta-viviendas/navarra/pagina-28.htm/inmueble/102355623/","385,000 €","3 hab. 180 m²","Nueva Promoción Condominio 10 DESDE: 375.000€ Chalets adosados de tres o cuatro habitaciones. Chalets adosados de nueva construcción en el entorno de Zuasti, el más importante complejo de ocio y vivie",""
"Navarra","Chalet adosado en avenida Concejo de Iza, 36, Iza","https://www.idealista.com/venta-viviendas/navarra/pagina-28.htm/inmueble/102355667/","450,000 €","3 hab. 214 m²","Nueva Promoción Condominio 10 DESDE: 450.000€ Chalets adosados de tres o cuatro habitaciones. Chalets adosados de nueva construcción en el entorno de Zuasti, el más importante complejo de ocio y vivie",""
"Navarra","Chalet adosado en avenida Concejo de Iza, 36, Iza","https://www.idealista.com/venta-viviendas/navarra/pagina-28.htm/inmueble/102372531/","385,000 €","4 hab. 180 m²","Nueva Promoción Condominio 10 DESDE: 375.000€ Chalets adosados de tres o cuatro habitaciones. Chalets adosados de nueva construcción en el entorno de Zuasti, el más importante complejo de ocio y vivie",""
"Navarra","Chalet adosado en avenida Concejo de Iza, 36, Iza","https://www.idealista.com/venta-viviendas/navarra/pagina-28.htm/inmueble/102372524/","375,000 €","4 hab. 180 m²","Nueva Promoción Condominio 10 DESDE: 375.000€ Chalets adosados de tres o cuatro habitaciones. Chalets adosados de nueva construcción en el entorno de Zuasti, el más importante complejo de ocio y vivie",""
"Navarra","Chalet en calle las Eras, 2, San Martin de Unx","https://www.idealista.com/venta-viviendas/navarra/pagina-28.htm/inmueble/101263887/","72,000 €","2 hab. 81 m²","Casa reformada de 63m2 en San Martín de Unx. Entorno rural y tranquilo a escasos 10 minutos de la localidad de Olite y 15 de Tafalla. DISTRIBUCIÓN DE LA VIVIENDA: Planta sótano, baja y primera. El acc",""
"Navarra","Chalet adosado en avenida Concejo de Iza, 36, Iza","https://www.idealista.com/venta-viviendas/navarra/pagina-28.htm/inmueble/102340956/","375,000 €","3 hab. 180 m²","Nueva Promoción Condominio 10 DESDE: 375.000€ Chalets adosados de tres o cuatro habitaciones. Chalets adosados de nueva construcción en el entorno de Zuasti, el más importante complejo de ocio y vivie",""
"Navarra","Chalet adosado en avenida Concejo de Iza, 36, Iza","https://www.idealista.com/venta-viviendas/navarra/pagina-28.htm/inmueble/102372512/","450,000 €","4 hab. 214 m²","Nueva Promoción Condominio 10 DESDE: 450.000€ Chalets adosados de tres o cuatro habitaciones. Chalets adosados de nueva construcción en el entorno de Zuasti, el más importante complejo de ocio y vivie",""
"Navarra","Piso en avenida Zaragoza, Milagrosa, Pamplona/Iruña","https://www.idealista.com/venta-viviendas/navarra/pagina-28.htm/inmueble/101368419/","295,000 €","3 hab. 133 m² Planta 1ª exterior con ascensor","Amplia vivienda excelentemente ubicada en la muga entre un entorno consolidado y cercano al centro de Pamplona y el barrio de Nueva Arrosadía. Con reforma completa, pensada en dar amplitud y luminosid",""
"Navarra","Piso en avenida Carlos III el Noble, 2º Ensanche, Pamplona/Iruña","https://www.idealista.com/venta-viviendas/navarra/pagina-28.htm/inmueble/87602586/","550,000 €","3 hab. 147 m² Planta 5ª exterior con ascensor","La estupenda vivienda que aquí les presentamos se encuentra en el centro de la Avda. de Carlos III el Noble. La zona, por tanto, no necesita mucha presentación. Todo a tu alcance: Comercios, supermerc",""
"Navarra","Finca rústica en alto Paraje Campo, s/n, Marcilla","https://www.idealista.com/venta-viviendas/navarra/pagina-28.htm/inmueble/90593058/","210,000 €","2 hab. 103 m²","¡Oportunidad! ¡Por no poder atender se vende impresionante finca rústica en Marcilla! ¡Sí está buscando un lugar donde poder descansar, disfrutar del campo y la tranquilidad, pero también poder celebr",""
"Navarra","Piso en calle Ventura Rodriguez, Buztintxuri, Pamplona/Iruña","https://www.idealista.com/venta-viviendas/navarra/pagina-28.htm/inmueble/101126202/","189,990 €","2 hab. 90 m² Planta 1ª exterior con ascensor","IMPECABLE VIVIENDA A LA VENTA EN BUZTINTXURI! AÑO 2005 ACESO A LA VIVIENDA POR PLAZA INTERIOR DE USO PRIVADO Calle Ventura Rodriguez, Una urbanización familiar y tranquila, compuesta por edificios de",""
"Navarra","Piso en calle de la Zapatería, Casco Antiguo, Pamplona/Iruña","https://www.idealista.com/venta-viviendas/navarra/pagina-28.htm/inmueble/101900531/","105,000 €","1 hab. 56 m² Planta 5ª interior sin ascensor","Coqueto apartamento. En el corazón de Pamplona. Edificio rehabilitado. Preciosas vistas a la Iglesia San Saturnino. Aunque este apartamento está en pleno centro, nos ofrece una estancia tranquila y si",""
"Navarra","Piso en avenida de Sancho el Fuerte, Iturrama, Pamplona/Iruña","https://www.idealista.com/venta-viviendas/navarra/pagina-28.htm/inmueble/102064717/","450,000 €","4 hab. 197 m² Planta 1ª exterior con ascensor","ESTUPENDO PISO CON TERRAZAS EN TORRE BASOKO. MUY LUMINOSO Y AMPLIO. DOS PLAZAS DE GARAJE Se vende espectacular piso en Sancho el Fuerte, uno de los mejores edificios de Pamplona tanto por su ubicación",""
"Navarra","Piso en Santa Ana, 4, Buñuel","https://www.idealista.com/venta-viviendas/navarra/pagina-28.htm/inmueble/101926071/","102,900 €","3 hab. 88 m² Planta 1ª exterior con ascensor","Se vende piso en el pueblo de Buñuel, en Navarra. Este piso de 80 m2 ofrece una combinación perfecta de comodidad y funcionalidad. Entrando, en primer lugar, encontramos un luminoso salón comedor y un",""
"Navarra","Piso en calle Monasterio de Irache, 23, San Juan, Pamplona/Iruña","https://www.idealista.com/venta-viviendas/navarra/pagina-28.htm/inmueble/100524905/","188,000 €","3 hab. 80 m² Planta 3ª interior con ascensor","¡Sí está buscando vivienda en San Juan, no deje pasar esta oportunidad! Ideal como vivienda habitual o como inversión. Se vende coqueto piso en el barrio de San Juan, calle Monasterio de Irache con to",""
"Navarra","Piso en calle de Joaquín Imaz Martínez, 3, Lezkairu, Pamplona/Iruña","https://www.idealista.com/venta-viviendas/navarra/pagina-28.htm/inmueble/102348184/","481,400 €","4 hab. 143 m² Planta 1ª exterior con ascensor","PISO CON AMPLISIMA TERRAZA, 4 DORMITORIOS CON 2 BAÑOS, GARAJE Y TRASTERO. Edificio de 2016, situado cerca del centro de Pamplona, en una urbanización con zonas verdes y piscina privada. El piso dispon",""
"Navarra","Casa o chalet independiente en Na-6030, Artajona","https://www.idealista.com/venta-viviendas/navarra/pagina-28.htm/inmueble/101265193/","220,000 €","3 hab. 120 m²","Situado a 20 minutos de Pamplona, en Artajona, se vende esta estupenda finca compuesta de una casa y un almacén independiente de 165 metros. La parcela total consta de 560 m2. La vivienda está distrib",""
"Navarra","Piso en Julián Gayarre, 2, Funes","https://www.idealista.com/venta-viviendas/navarra/pagina-28.htm/inmueble/96029468/","126,000 €","4 hab. 170 m² Planta 4ª exterior con ascensor","¡Oportunidad! Se vende magnífico piso de 157 m2 en el centro de Funes, probablemente en uno de los mejores y más emblemáticos edificios del pueblo. ¡Refórmalo a tu gusto y vive en el centro del pueblo",""
"Navarra","Casa o chalet independiente en Cizur","https://www.idealista.com/venta-viviendas/navarra/pagina-28.htm/inmueble/101049326/","735,000 €","4 hab. 325 m²","VILLA INDEPENDIENTE EN CIZUR. GARAJE INCLUIDO. CASA DE PIEDRA de 325 m2 en PARCELA AJARDINADA de 1825 m2. Villa unifamiliar de dos plantas con un total de 325m2 construidos, JARDÍN PRIVADO en parcela",""
"Navarra","Casa o chalet independiente en Larraun","https://www.idealista.com/venta-viviendas/navarra/pagina-28.htm/inmueble/99116276/","580,000 €","4 hab. 345 m²","Preciosa CASA INDEPENDIENTE con encanto. Situada en Mugiro, Navarra, junto a Lekunberri y la Autovía A-15. Con JARDÍN PRIVADO, GARAJE Y TERRENO de 10.000m2 con HUERTA e INVERNADERO. DESCRIPCIÓN GENERA",""
"Navarra","Casa o chalet independiente en Larraun","https://www.idealista.com/venta-viviendas/navarra/pagina-29.htm/inmueble/99116276/","580,000 €","4 hab. 345 m²","Preciosa CASA INDEPENDIENTE con encanto. Situada en Mugiro, Navarra, junto a Lekunberri y la Autovía A-15. Con JARDÍN PRIVADO, GARAJE Y TERRENO de 10.000m2 con HUERTA e INVERNADERO. DESCRIPCIÓN GENERA",""
"Navarra","Piso en Lekunberri","https://www.idealista.com/venta-viviendas/navarra/pagina-29.htm/inmueble/101468739/","120,000 €","2 hab. 70 m² Planta 3ª exterior con ascensor","Se vende piso de 65m2 aproximadamente con GARAJE CERRADO incluido en Lekunberri, Navarra. Se distribuye en hall con armario empotrado, sala con salida a balcón, cocina independiente con salida a balcó",""
"Navarra","Piso en calle Sierra de Andía, Egüés","https://www.idealista.com/venta-viviendas/navarra/pagina-29.htm/inmueble/101330709/","232,000 €","3 hab. 103 m² Planta 4ª exterior con ascensor","¿Buscas un piso listo para entrar a vivir en una de las zonas más asentadas de Pamplona? Continúa leyendo porque nuestra propuesta te va a gustar Ubicado en Sarriguren, este magnífico piso VPT de tres",""
"Navarra","Piso en calle Dormitalería, 34, Casco Antiguo, Pamplona/Iruña","https://www.idealista.com/venta-viviendas/navarra/pagina-29.htm/inmueble/102371430/","220,000 €","3 hab. 69 m² Planta 3ª exterior sin ascensor","ENGEL&VÖLKERS Pamplona presenta piso de 69 m2 en 3ª Planta, ideal para vivir y con licencia turística, con altas rentabilidades comprobables. Esta es una importantísima ventaja, en la actualidad ya no",""
"Navarra","Piso en calle la Plana, Tafalla","https://www.idealista.com/venta-viviendas/navarra/pagina-29.htm/inmueble/102015413/","86,000 €","3 hab. 116 m² Planta 1ª exterior sin ascensor","Piso céntrico de 97 m2 útiles, en calle La Plana nº8-1º. Buen estado de conservación y listo para entrar a vivir sin necesidad de realizar una gran inversión. Con opción a plaza de garaje cerrada de 1",""
"Navarra","Casa o chalet independiente en Zelai, Egüés","https://www.idealista.com/venta-viviendas/navarra/pagina-29.htm/inmueble/88055371/","800,000 €","4 hab. 760 m²","TE OFRECEMOS EN VENTA 12 CHALETS DE LUJO en Gorraiz y Elcano de los 23 disponibles en esta zona con importes entre los 750.000 y 3 millones de euros. VENDIDO.. . este LUJO de chalet en el Club de Golf",""
"Navarra","Chalet en calle de Navarra, Oloriz","https://www.idealista.com/venta-viviendas/navarra/pagina-29.htm/inmueble/100844109/","232,000 €","10 hab. 800 m²","Casa con espacio para TODO lo que quieras. Situada en un entorno rural, tenemos esta espectacular casa de 615m2 útiles, con una gran bajera de 274m2, asador y patio de 756m2 (Zona pavimentada + jardín",""
"Navarra","Chalet pareado en castillo de maya, 2º Ensanche, Pamplona/Iruña","https://www.idealista.com/venta-viviendas/navarra/pagina-29.htm/inmueble/94219806/","895,000 €","6 hab. 250 m²","VENTA CHALET en el Segundo Ensanche Pamplona (Navarra), c/ Castillo de Maya, precioso y práctico. SE VENDE CHALET EN EL SEGUNDO ENSANCHE, esquina Calle Castillo de Maya con Aralar. Un paraíso en mitad",""
"Navarra","Chalet pareado en calle Concejo de Erice de Iza, Iza","https://www.idealista.com/venta-viviendas/navarra/pagina-29.htm/inmueble/98732550/","398,000 €","7 hab. 259 m²","Elegante y acogedor pareado en Zuasti Residencial. Imagine vivir en una casa rodeada de un precioso robledal autóctono donde podrá dar paseos por caminos acondicionados. Si desea mantenerse en forma p",""
"Navarra","Piso en calle de Juan María Guelbenzu Kalea, Milagrosa, Pamplona/Iruña","https://www.idealista.com/venta-viviendas/navarra/pagina-29.htm/inmueble/100477975/","178,000 €","3 hab. 84 m² Planta 2ª exterior con ascensor","Milagrosa se está revitalizando a pasos agigantados. Uno de los mejores barrios por su cercanía al centro de Pamplona, a las Universidades y por su consolidación en servicios y comercios. El piso está",""
