"provincia","tipo/lugar","link","precio","caracteristicas","info","otros"
"Navarra","Ático en calle Parroquia, Doneztebe/Santesteban","https://www.idealista.com/venta-viviendas/navarra/pagina-14.htm/inmueble/96029181/","155,000 €","3 hab. 70 m² exterior con ascensor","Espectaculares áticos duplex de 70 m2 útiles  con reforma integral, en Santesteban. 3º y última planta con ascensor en el centro del pueblo. Se comenzará la instalación del ascensor a cota 0, mejorand",""
"Navarra","Piso en calle las Blancas, 4, Lezkairu, Pamplona/Iruña","https://www.idealista.com/venta-viviendas/navarra/pagina-14.htm/inmueble/101031667/","284,000 €","2 hab. 81 m² Planta 4ª exterior con ascensor","INICIADA LA PROMOCION CUYA FINALIZACION ESTA PREVISTA EN JUNIO 2025 19 VIVIENDAS EN LEZKAIRU En una situación privilegiada por la amplitud de espacios del entorno, la orientación y las vistas, ofrece",""
"Navarra","Piso en Gonzalez Tablas, 2º Ensanche, Pamplona/Iruña","https://www.idealista.com/venta-viviendas/navarra/pagina-14.htm/inmueble/102243443/","250,000 €","2 hab. 70 m² Planta 6ª exterior con ascensor","Bonito piso con altura en pleno segundo ensanche, dispone de 2 habitaciones a zona interior, el salón muy luminoso da a calle Bergamín, dispone también de una pequeña sala de estar que podría habilita",""
"Navarra","Piso en calle Manresa, Centro, Tudela","https://www.idealista.com/venta-viviendas/navarra/pagina-14.htm/inmueble/99820361/","230,000 €","4 hab. 208 m² Planta 2ª exterior sin ascensor","SE VENDE ESPECTACULAR PISO EN EL CENTRO DE TUDELA A ESCASOS METROS DE LA AVDA. ZARAGOZA. A un minuto del Centro de Salud, de supermercados y tiendas. MUY LUMINOSO Y ESPACIOSO. ¡2ª PLANTA SIN ASCENSOR!",""
"Navarra","Chalet en calle la Rueda, Viana","https://www.idealista.com/venta-viviendas/navarra/pagina-14.htm/inmueble/100918563/","64,000 €","3 hab. 207 m²","OPORTUNIDAD INVERSORES ¿Buscas rentabilidad? Excelente ubicación, muy cerca del centro histórico de Viana La casa esta para reformar, tiene acceso por dos calles y posibilidad de independizar la casa",""
"Navarra","Piso en calle Vuelta del Castillo, 1º Ensanche, Pamplona/Iruña","https://www.idealista.com/venta-viviendas/navarra/pagina-14.htm/inmueble/94486062/","400,000 €","4 hab. 110 m² Planta 4ª exterior con ascensor","AM Gestión Inmobiliaria les ofrece piso en pleno pulmón de la ciudad, ubicado en el barrio de Iturrama, con vistas a la Vuelta del Castillo. La vivienda consta de un amplio salón con balcón, cuatro ha",""
"Navarra","Piso en calle Beheitiko Erreka con C/Lizarra, s/n, Irurtzun","https://www.idealista.com/venta-viviendas/navarra/pagina-14.htm/inmueble/101626704/","315,000 €","4 hab. 154 m² Planta 1ª exterior con ascensor","Situada al sur de Irurtzun, destaca por la amplitud de espacios del entorno, la orientación y las vistas, viviendas donde la luminosidad, amplitud y confort son los principales protagonistas, que se c",""
"Navarra","Piso en calle Beheitiko Erreka con C/Lizarra, s/n, Irurtzun","https://www.idealista.com/venta-viviendas/navarra/pagina-14.htm/inmueble/101146225/","222,000 €","2 hab. 112 m² Bajo exterior con ascensor","Situada al sur de Irurtzun, destaca por la amplitud de espacios del entorno, la orientación y las vistas, viviendas donde la luminosidad, amplitud y confort son los principales protagonistas, que se c",""
"Navarra","Piso en calle Villanueva, Lerin","https://www.idealista.com/venta-viviendas/navarra/pagina-14.htm/inmueble/100939800/","129,000 €","3 hab. 119 m² exterior sin ascensor","Piso céntrico en Lerín, con bajera, terraza y trastero, no se puede pedir más. En una de las mejores zonas de Lerín, muy cerca de la iglesia y el mirador se vende este espectacular piso en segunda pla",""
"Navarra","Piso en calle Beheitiko Erreka con C/Lizarra, s/n, Irurtzun","https://www.idealista.com/venta-viviendas/navarra/pagina-14.htm/inmueble/101139189/","280,000 €","3 hab. 126 m² Planta 1ª exterior con ascensor","Situada al sur de Irurtzun, destaca por la amplitud de espacios del entorno, la orientación y las vistas, viviendas donde la luminosidad, amplitud y confort son los principales protagonistas, que se c",""
"Navarra","Piso en calle las Blancas, 4, Lezkairu, Pamplona/Iruña","https://www.idealista.com/venta-viviendas/navarra/pagina-14.htm/inmueble/101673874/","270,000 €","2 hab. 81 m² Planta 2ª exterior con ascensor","INICIADA LA PROMOCION CUYA FINALIZACION ESTA PREVISTA EN JUNIO 2025 19 VIVIENDAS EN LEZKAIRU En una situación privilegiada por la amplitud de espacios del entorno, la orientación y las vistas, ofrece",""
"Navarra","Chalet pareado en calle Harizti, Iza","https://www.idealista.com/venta-viviendas/navarra/pagina-14.htm/inmueble/102229125/","495,000 €","4 hab. 294 m²","URBANTIA vende magnífico chalet pareado en el exclusivo Señorío de Zuasti, rodeado de un espacio natural de extraordinario valor y riqueza medioambiental, situado a escasos 10 minutos del centro de Pa",""
"Navarra","Piso en plaza Larrache, Iza","https://www.idealista.com/venta-viviendas/navarra/pagina-14.htm/inmueble/101033070/","205,000 €","2 hab. 90 m² Planta 3ª exterior con ascensor","Excelente piso en zuasti, inmejorable situación, zona tranquila, rodeado de naturaleza. 2habitaciones, 2baños, 2plazas de garaje.",""
"Navarra","Piso en calle Artajona, 28, Chantrea, Pamplona/Iruña","https://www.idealista.com/venta-viviendas/navarra/pagina-14.htm/inmueble/101825212/","159,000 €","3 hab. 80 m² Planta 1ª exterior sin ascensor","Precioso piso con mucha luz listo para entrar a vivir. Se encuentra una zona tranquila, a 5 minutos de transportes y servicios (guarderías, colegios, instituto y centro de salud. ), de fácil aparcamie",""
"Navarra","Dúplex en paseo Sarasate, Casco Antiguo, Pamplona/Iruña","https://www.idealista.com/venta-viviendas/navarra/pagina-14.htm/inmueble/101358892/","1,400,000 €","5 hab. 358 m² Planta 7ª exterior con ascensor","Dúplex-ático en pleno centro de Pamplona. Se trata de un edificio emblemático fusionando la zona del casco antiguo con el ensanche. A muy pocos metros de la conocida Plaza del Castillo. La vivienda co",""
"Navarra","Chalet adosado en calle Sector 1 Altos de Arazuzi, s/n, Olza","https://www.idealista.com/venta-viviendas/navarra/pagina-14.htm/inmueble/97550005/","320,000 €","4 hab. 130 m²","Obra nueva 130m² 4 hab. Garaje incluido El Residencial Altos de Arazuri es una promoción en Arazuri, un lugar privilegiado de la merindad de Pamplona, con preciosas vistas al valle. A 4 minutos de la",""
"Navarra","Chalet adosado en calle Sector 1 Altos de Arazuzi, s/n, Olza","https://www.idealista.com/venta-viviendas/navarra/pagina-14.htm/inmueble/97550101/","345,000 €","4 hab. 138 m²","Obra nueva 138m² 4 hab. Garaje incluido El Residencial Altos de Arazuri es una promoción en Arazuri, un lugar privilegiado de la merindad de Pamplona, con preciosas vistas al valle. A 4 minutos de la",""
"Navarra","Chalet pareado en calle Sector 1 Altos de Arazuzi, s/n, Olza","https://www.idealista.com/venta-viviendas/navarra/pagina-14.htm/inmueble/97550102/","380,000 €","4 hab. 140 m²","Obra nueva 140m² 4 hab. Garaje incluido El Residencial Altos de Arazuri es una promoción en Arazuri, un lugar privilegiado de la merindad de Pamplona, con preciosas vistas al valle. A 4 minutos de la",""
"Navarra","Piso en calle de Tiebas, Chantrea, Pamplona/Iruña","https://www.idealista.com/venta-viviendas/navarra/pagina-14.htm/inmueble/102229158/","139,000 €","3 hab. 79 m² Planta 1ª exterior sin ascensor","URBANTIA vende piso la mejor zona de la Txantrea de siempre, en un agradable y tranquilo entorno de viviendas colectivas de baja densidad, con todos los servicios y equipamiento urbano de primer orden",""
"Navarra","Dúplex en Viana","https://www.idealista.com/venta-viviendas/navarra/pagina-14.htm/inmueble/100363367/","181,000 €","3 hab. 130 m² Planta 3ª exterior con ascensor","PISO DÚPLEX AMUEBLADO TODO EXTERIOR CON EXTRAORDINARIAS VISTAS * EDIFICIO DE POCOS AÑOS * PLAZA DE GARAJE GRANDE * TRASTERO 12 M² * EXCELENTE ALTURA Y ORIENTACIÓN * UBICACIÓN PERFECTA PARA DISFRUTAR D",""
"Navarra","Piso en avenida de Guipúzcoa, Berriozar","https://www.idealista.com/venta-viviendas/navarra/pagina-14.htm/inmueble/101764582/","162,000 €","3 hab. 108 m² Planta 4ª exterior con ascensor","Frente al instituto amplio piso de tres dormitorios, un baño, cocina y salón, para entrar a vivir, solo coja sus maletas y trasládese. Buena altura, 4ª planta, con vistas despejadas y terraza. Autobús",""
"Navarra","Piso en calle Escuelas, Lodosa","https://www.idealista.com/venta-viviendas/navarra/pagina-14.htm/inmueble/99255414/","97,000 €","2 hab. 68 m² Planta 1ª exterior con ascensor","Inmobiliaria Sarasate de Estella-Lizarra presenta; Estupendo piso en venta en Lodosa, en el centro del pueblo a un minuto de todos los servicios. Entramos y tebemos un pequeño hall que nos distribuye",""
"Navarra","Casa o chalet independiente en calle Cascante, Fontellas","https://www.idealista.com/venta-viviendas/navarra/pagina-15.htm/inmueble/101592364/","450,000 €","7 hab. 450 m²","ESPECTACULAR VIVIENDA TURÍSTICA. ¿Quieres invertir y tener tu propio negocio? Te presentamos esta vivienda turística en pleno rendimiento, magnífica oportunidad para tener grandes ingresos. La casa es",""
"Navarra","Piso en avenida Zaragoza, Centro, Tudela","https://www.idealista.com/venta-viviendas/navarra/pagina-15.htm/inmueble/98768182/","99,000 €","2 hab. 137 m² Planta 5ª exterior sin ascensor","Remax Finca Hogar, pone a la venta un piso muy grande en el mismo centro de Tudela. NO TIENE ASCENSOR. La vivienda consta de dos dormitorios, gran salón muy luminoso, cocina reformada y baño completo",""
"Navarra","Chalet adosado en calle Iturrierreka, Orcoyen","https://www.idealista.com/venta-viviendas/navarra/pagina-15.htm/inmueble/102231388/","290,000 €","4 hab. 190 m²","Casa en venta ubicada en Orcoyen, situada en la Merindad de Pamplona y a 5km del centro de la ciudad. Se trata de una vivienda construida en el año 1988 y emplazada en una parcela de 267m2, la misma p",""
"Navarra","Piso en cuesta del Hospital, Lumbier","https://www.idealista.com/venta-viviendas/navarra/pagina-15.htm/inmueble/102210664/","100,000 €","3 hab. 94 m² Planta 1ª exterior sin ascensor","Inmobiliaria Vissta presenta en exclusiva este magnífico piso ubicado en Lumbier a 38 km de Pamplona. Se trata de un primer piso exterior con una superficie construida de 94 m2 y útil de 76 m2. Se enc",""
"Navarra","Piso en avenida de Sancho el Fuerte, Iturrama, Pamplona/Iruña","https://www.idealista.com/venta-viviendas/navarra/pagina-15.htm/inmueble/102255806/","329,000 €","3 hab. 120 m² Planta 9ª exterior con ascensor","Inmobiliaria Vissta presenta esta magnífica oportunidad situada en la Avenida Sancho el Fuerte de Pamplona en el Barrio de Iturrama. Se trata de un maravilloso piso exterior y luminoso, ubicado en la",""
"Navarra","Piso en Centro, Tudela","https://www.idealista.com/venta-viviendas/navarra/pagina-15.htm/inmueble/99273650/","149,900 €","3 hab. 135 m² Planta 3ª exterior sin ascensor","Amplio piso en pleno centro de Tudela, a escasos metros de la plaza nueva y vistas a La Carrera. 135 m² de superficie distribuidos en salón, 3 habitaciones dobles, cocina independiente completamente e",""
"Navarra","Chalet en Lugar Barrio Lakain, 11, Etxalar","https://www.idealista.com/venta-viviendas/navarra/pagina-15.htm/inmueble/100499660/","750,000 €","4 hab. 300 m²","En el pueblo de Etxalar, a pocos kilómetros adentrándote en la naturaleza, encontrarás una casita de ensueño edificada en la ladera del monte. Se construyó sobre una excavación en el mismo, y tras ell",""
"Navarra","Chalet adosado en calle del Bailío, Lourdes, Tudela","https://www.idealista.com/venta-viviendas/navarra/pagina-15.htm/inmueble/100729548/","230,000 €","3 hab. 170 m²","Se vende ADOSADO para entrar a vivir. En la planta baja tenemos el garaje y un magnífico merendero con cocina equipada con todos los electrodomésticos, es de madera maciza, y tiene mesa y bancos a jue",""
"Navarra","Piso en avenida de Zaragoza, 21, 2º Ensanche, Pamplona/Iruña","https://www.idealista.com/venta-viviendas/navarra/pagina-15.htm/inmueble/97046393/","370,000 €","2 hab. 95 m² Planta 5ª exterior con ascensor","EDIFIDIO SOL - Próxima rehabilitación por completo del edificio para entregar viviendas totalmente rehabilitadas a estrenar. Carpinterías exteriores de PVC con aperturas oscilobatientes. Vidrios y per",""
"Navarra","Casa o chalet independiente en ronda de Cizur, Cizur","https://www.idealista.com/venta-viviendas/navarra/pagina-15.htm/inmueble/102210676/","549,500 €","4 hab. 366 m²","Inmobiliaria Vissta ofrece en exclusiva este magnífico chalet pareado en Cizur Menor, a tan solo 5 minutos de Pamplona. Se trata de una selecta zona residencial muy tranquila y segura, ideal para fami",""
"Navarra","Piso en Egüés","https://www.idealista.com/venta-viviendas/navarra/pagina-15.htm/inmueble/101624480/","319,900 €","3 hab. 116 m² Planta 1ª exterior con ascensor","Este espectacular ático tipo duplex se encuentra situado en una tranquila población rodeada de naturaleza, ideal para aquellos que buscan un estilo de vida relajado. Con una ubicación privilegiada, es",""
"Navarra","Piso en avenida Zaragoza, Centro, Tudela","https://www.idealista.com/venta-viviendas/navarra/pagina-15.htm/inmueble/99075458/","170,000 €","3 hab. 160 m² Planta 3ª exterior sin ascensor","Remax Finca Hogar, pone a la venta un magnífico piso en el mismo centro de Tudela. La vivienda está ubicada en una zona inmejorable del centro de Tudela Es un piso muy grande y luminoso, con una refor",""
"Navarra","Piso en avenida de la Constitución, Corella","https://www.idealista.com/venta-viviendas/navarra/pagina-15.htm/inmueble/101233638/","120,000 €","4 hab. 120 m² Planta 2ª exterior sin ascensor","Estas pensando en comprar una vivienda? Este piso es para ti, ubicado en la localidad de Corella, a 10 minutos de Tudela y a 1 hora de Pamplona. Con una distribución que aprovecha todos los espacios,",""
"Navarra","Caserón en San Lorenzo, s/n, Larraun","https://www.idealista.com/venta-viviendas/navarra/pagina-15.htm/inmueble/95722520/","154,000 €","4.216 m²","CONECTAR CON LA NATURALEZA PARA DESCONECTAR ODERITZ (VALLE DE LARRAUN) Magnifica Finca con encanto en Oderitz (Valle de Larraun -Navarra) 4216 m2 de superficie total. ODERITZ es un precioso pueblo, si",""
"Navarra","Piso en avenida Zaragoza, Centro, Tudela","https://www.idealista.com/venta-viviendas/navarra/pagina-15.htm/inmueble/99075226/","145,000 €","4 hab. 160 m² Planta 2ª exterior sin ascensor","Remax Finca Hogar pone a la venta una vivienda en el mismo centro de Tudela La vivienda tiene una reforma prácticamente integral, incluida toda la electricidad, con materiales de gran calidad, por lo",""
"Navarra","Piso en plaza Santa Cecilia, Milagrosa, Pamplona/Iruña","https://www.idealista.com/venta-viviendas/navarra/pagina-15.htm/inmueble/102255818/","159,000 €","3 hab. 80 m² Planta 4ª exterior con ascensor","Inmobiliaria Vissta ofrece en exclusiva esta oportunidad ubicada en la zona de los edificios inteligentes de Pamplona, ideal como primera vivienda o como inversión. Se trata de un cuarto piso exterior",""
"Navarra","Piso en calle San Fermín, Cadreita","https://www.idealista.com/venta-viviendas/navarra/pagina-15.htm/inmueble/97406113/","110,000 €","3 hab. 115 m² Planta 1ª exterior sin ascensor","Este estupendo piso se encuentra en Calle San Fermín, 31515, Cadreita, Navarra, en la planta 1. Es un piso que tiene 115 m2, de los cuales 105 son útiles. Dispone de 3 habitaciones, 2 baños, salón del",""
"Navarra","Piso en ronda Santa Quiteria, Parque del Queiles, Tudela","https://www.idealista.com/venta-viviendas/navarra/pagina-15.htm/inmueble/100996126/","169,000 €","3 hab. 95 m² Planta 3ª exterior con ascensor","Desde inmobiliaria Laiak ponemos a la venta este bonito piso VPO situado en Paseo Ronda Santa Quiteria, 31500, Tudela, Navarra, que tiene 95m2 de los cuales 80m2 son útiles. El piso cuenta con tres ha",""
"Navarra","Piso en calle Juan Antonio Fernández, Centro, Tudela","https://www.idealista.com/venta-viviendas/navarra/pagina-15.htm/inmueble/101592256/","140,000 €","4 hab. 124 m² Planta 5ª exterior con ascensor","Desde inmobiliaria Laiak ponemos a la venta este piso situado en Juan Antonio Fernández, 31500, Tudela, Navarra. El piso tiene 124m2 de los cuales 93m2 son útiles. El piso cuenta con cuatro habitacion",""
"Navarra","Chalet en avenida Narangel, s/n, Parque del Queiles, Tudela","https://www.idealista.com/venta-viviendas/navarra/pagina-15.htm/inmueble/101960190/","295,000 €","3 hab. 163 m²","Unifamiliar a estrenar en Queiles. En la planta principal disponemos de  un gran salón, comedor y cocina en distribución abierta y aseo, un amplio espacio de día abierto y con salida directa al porche",""
"Navarra","Casa o chalet independiente en calle San Juan, Odieta","https://www.idealista.com/venta-viviendas/navarra/pagina-15.htm/inmueble/100757829/","339,000 €","4 hab. 371 m²","Desde inmobiliaria Laiak sacamos esta bonita casa a la venta en el pueblo de Ostiz a 15 minutos de Pamplona. La vivienda consta de 3 plantas distribuidas de la siguiente manera: Planta principal: un d",""
"Navarra","Chalet adosado en calle Iñigo Arista, Cintruénigo","https://www.idealista.com/venta-viviendas/navarra/pagina-15.htm/inmueble/101855099/","153,000 €","4 hab. 119 m²","Desde inmobiliaria Laiak ponemos a la venta esta casa situada en C/ Iñigo Arista, 31592, Cintruenigo. La casa tiene una parcela de153m2 de los cuales construidos 119m2, útiles 99m2. La casa se distrib",""
"Navarra","Piso en calle Juan Antonio Fernández, Centro, Tudela","https://www.idealista.com/venta-viviendas/navarra/pagina-15.htm/inmueble/95484947/","120,000 €","3 hab. 110 m² Planta 6ª exterior con ascensor","Este piso se encuentra en Calle Juan Antonio Fernández, 31500, Tudela, Navarra, situado en el distrito de Centro, en la planta 6. Es un piso que tiene 110 m2 de los cuales 103 m2 son útiles. Dispone d",""
"Navarra","Piso en avenida Zaragoza, Griseras - Gardachales, Tudela","https://www.idealista.com/venta-viviendas/navarra/pagina-15.htm/inmueble/100113320/","135,000 €","4 hab. 120 m² Planta 7ª exterior con ascensor","Este piso se encuentra en Avenida Zaragoza, 31500, Tudela, Navarra, en la planta 7. Es un piso que tiene 120m2. El piso consta de cuatro habitaciones, dos baño, uno en habitación principal, cocina, sa",""
"Navarra","Piso en plaza Sancho VII el Fuerte, Centro, Tudela","https://www.idealista.com/venta-viviendas/navarra/pagina-15.htm/inmueble/96276620/","215,000 €","3 hab. 125 m² Planta 6ª exterior con ascensor","Este piso se encuentra en Plaza Sancho VII el Fuerte, 31500, Tudela, Navarra, en la planta 6. Es un piso soleado que tiene 125 m2 de los cualeas 120 m2 son útiles. Dispone de hall, 3 habitaciones, un",""
"Navarra","Chalet adosado en calle Olmos, Puente la Reina","https://www.idealista.com/venta-viviendas/navarra/pagina-15.htm/inmueble/102283039/","298,000 €","3 hab. 186 m²","En Puente la Reina (Barrio Zabaltzagain) ofrecemos este estupendo adosado en parcela total de 160,80 m2 y que se compone y distribuye de la siguiente forma: Sótano: Txoko de 28 m2 y desde el que se ac",""
"Navarra","Piso en calle de Leyre, 2º Ensanche, Pamplona/Iruña","https://www.idealista.com/venta-viviendas/navarra/pagina-15.htm/inmueble/101622126/","670,000 €","5 hab. 236 m² Planta 4ª exterior con ascensor","A&P inmobiliaria vende en Pamplona, vivienda en la calle Leyre, peatonal con Carlos III. Con 210 m² útiles, nos encontramos con una casa con una reforma importante. Desde la entrada principal, accedem",""
"Navarra","Piso en avenida de Madrid, Cascante","https://www.idealista.com/venta-viviendas/navarra/pagina-15.htm/inmueble/92515602/","85,000 €","3 hab. 115 m² Planta 2ª exterior con ascensor","Este piso se encuentra en Avenida de Madrid, 31520, Cascante, Navarra, situado en el distrito de Centro, en la planta 2. Es un piso amueblado que tiene 115 m2 de los cuales 105 m2 son útiles y dispone",""
"Navarra","Chalet pareado en calle Río Huecha, Cortes","https://www.idealista.com/venta-viviendas/navarra/pagina-15.htm/inmueble/101214465/","161,000 €","3 hab. 148 m²","Precioso Pareado a la venta en Cortes de Navarra, a 15 minutos de Tudela. Te presentamos este estupendo pareado, es vivienda de VPO, por lo que es imprescindible cumplir requisitos. Su distribución es",""
"Navarra","Piso en calle Blanca de Navarra, Griseras - Gardachales, Tudela","https://www.idealista.com/venta-viviendas/navarra/pagina-15.htm/inmueble/101920951/","195,000 €","3 hab. 124 m² Bajo exterior con ascensor","Desde inmobiliaria Laiak ponemos a la venta este piso situado en C/Blanca de Navarra, 31500, Tudela. El piso tiene 124m2 de cuales útiles 89m2. Es un bajo exterior que cuenta con tres amplias habitaci",""
"Navarra","Casa de pueblo en Mercado Monreal, Monreal","https://www.idealista.com/venta-viviendas/navarra/pagina-16.htm/inmueble/101278627/","150,000 €","2 hab. 125 m²","Se vende casa en Monreal en buen estado de conservación. La vivienda se divide en tres plantas. En planta baja trastero y garaje. La primera planta consta de cocina y sala de estar. En segunda planta",""
"Navarra","Chalet adosado en calle Iñigo Arista, Cintruénigo","https://www.idealista.com/venta-viviendas/navarra/pagina-16.htm/inmueble/101855099/","153,000 €","4 hab. 119 m²","Desde inmobiliaria Laiak ponemos a la venta esta casa situada en C/ Iñigo Arista, 31592, Cintruenigo. La casa tiene una parcela de153m2 de los cuales construidos 119m2, útiles 99m2. La casa se distrib",""
"Navarra","Casa o chalet independiente en avenida Nuestra Señora del Carmen, Ribaforada","https://www.idealista.com/venta-viviendas/navarra/pagina-16.htm/inmueble/100863429/","420,000 €","3 hab. 230 m²","Desde inmobiliaria Laiak ponemos a la venta esta espectacular casa/chalet independiente situada en Avenida Nuestra Señora del Carmen, 31550, Ribaforada. La casa tiene 230m2 de los cuales útiles 220m2",""
"Navarra","Piso en plaza Sancho VII el Fuerte, Centro, Tudela","https://www.idealista.com/venta-viviendas/navarra/pagina-16.htm/inmueble/96276620/","215,000 €","3 hab. 125 m² Planta 6ª exterior con ascensor","Este piso se encuentra en Plaza Sancho VII el Fuerte, 31500, Tudela, Navarra, en la planta 6. Es un piso soleado que tiene 125 m2 de los cualeas 120 m2 son útiles. Dispone de hall, 3 habitaciones, un",""
"Navarra","Piso en avenida Central, Barañain","https://www.idealista.com/venta-viviendas/navarra/pagina-16.htm/inmueble/102222344/","185,000 €","3 hab. 94 m² Planta 5ª exterior con ascensor","Rive presenta esta gran oportunidad de adquirir una vivienda en pleno centro y zona principal de Barañáin. Edificio ubicado frente al IES Barañáin y cercano al polideportivo municipal y con magníficas",""
"Navarra","Piso en calle Blanca de Navarra, Griseras - Gardachales, Tudela","https://www.idealista.com/venta-viviendas/navarra/pagina-16.htm/inmueble/101920951/","195,000 €","3 hab. 124 m² Bajo exterior con ascensor","Desde inmobiliaria Laiak ponemos a la venta este piso situado en C/Blanca de Navarra, 31500, Tudela. El piso tiene 124m2 de cuales útiles 89m2. Es un bajo exterior que cuenta con tres amplias habitaci",""
"Navarra","Piso en calle Fuente Canónigos, Griseras - Gardachales, Tudela","https://www.idealista.com/venta-viviendas/navarra/pagina-16.htm/inmueble/93984621/","190,000 €","4 hab. 165 m² Planta 6ª exterior con ascensor","Este piso se encuentra en Calle Fuente Canónigos, 31500, Tudela, Navarra, situado en el distrito de Griseras, en la planta 6. Es un piso, construido en el año 1990, que tiene 165 m2 de los cuales 145",""
"Navarra","Piso en avenida Zaragoza, Griseras - Gardachales, Tudela","https://www.idealista.com/venta-viviendas/navarra/pagina-16.htm/inmueble/100113320/","135,000 €","4 hab. 120 m² Planta 7ª exterior con ascensor","Este piso se encuentra en Avenida Zaragoza, 31500, Tudela, Navarra, en la planta 7. Es un piso que tiene 120m2. El piso consta de cuatro habitaciones, dos baño, uno en habitación principal, cocina, sa",""
"Navarra","Casa o chalet independiente en calle Saturnino Sagasti, Fitero","https://www.idealista.com/venta-viviendas/navarra/pagina-16.htm/inmueble/101316027/","93,000 €","7 hab. 250 m²","Desde inmobiliaria Laiak ponemos a la venta esta casa situada en Calle Saturnino Sagasti, 31593, Fitero, Navarra. Es una casa que tiene 250m2. La casa se distribuye en tres plantas de unos 85m2 cada u",""
"Navarra","Casa o chalet independiente en calle Ciudad Jardín, Cascante","https://www.idealista.com/venta-viviendas/navarra/pagina-16.htm/inmueble/100860981/","180,000 €","5 hab. 250 m²","Desde inmobiliaria Laiak ponemos a la venta esta estupenda casa/chalet independiente situada en Carretera Tarazona S/N, 31520, Cascante, que tiene 250m2 útiles 200m2. La casa cuenta con cinco habitaci",""
"Navarra","Piso en avenida Zaragoza, Centro, Tudela","https://www.idealista.com/venta-viviendas/navarra/pagina-16.htm/inmueble/93469158/","130,000 €","3 hab. 110 m² Planta 5ª exterior sin ascensor","Desde inmobiliaria Laiak ponemos a la venta este piso que se encuentra en Avenida Zaragoza, 31500, Tudela, Navarra. Es un piso que tiene 110 m2 de los cuales 90 m2 son útiles. El piso cuenta con tres",""
