"provincia","tipo/lugar","link","precio","caracteristicas","info","otros"
"Navarra","Piso en calle Artzanegi, Lekunberri","https://www.idealista.com/venta-viviendas/navarra/pagina-40.htm/inmueble/101712134/","173,000 €","3 hab. 108 m² Planta 1ª con ascensor","VPO EN LEKUNBERRI En el pintoresco pueblo de Lekunberri, a pocos kilómetros de Pamplona, se encuentra esta increíble vivienda en un entorno rural. El encanto de vivir en un pueblo con todos los servic",""
"Navarra","Piso en calle Maria Camino Oscoz Urriza con Fidel Aparicio, 1, Lezkairu, Pamplona/Iruña","https://www.idealista.com/venta-viviendas/navarra/pagina-40.htm/inmueble/100311779/","365,000 €","3 hab. 131 m² exterior con ascensor","SERENNA Soto de Lezcairu es un proyecto de 16 viviendas exclusivas en construcción a 5 minutos del centro de Pamplona, en una zona muy demandada por sus excelentes comunicaciones y su dotación de serv",""
"Navarra","Chalet adosado en calle Monasterio de la Oliva, Corella","https://www.idealista.com/venta-viviendas/navarra/pagina-40.htm/inmueble/101497013/","196,000 €","3 hab. 160 m²","¡Vivienda unifamiliar en Corella! Adosado de 160 m2 en 2 plantas distribuidas en 3 dormitorios, 2 baños, 1 aseo, garaje, cocina, salón con acceso a un amplio jardín, porche delantero y terraza en la h",""
"Navarra","Piso en calle Fernando Remacha, 2, Milagrosa, Pamplona/Iruña","https://www.idealista.com/venta-viviendas/navarra/pagina-40.htm/inmueble/100275908/","219,900 €","1 hab. 57 m² Planta 5ª exterior con ascensor","COQUETO APARTAMENTO COMPLETAMENTE A EXTRENAR EN ARROSADÍA Frente a la Universidad Pública de Navarra: UPNA ENTREGA INMEDIATA Cuando nos ponemos a buscar casa, no solo debemos tener en cuenta las carac",""
"Navarra","Piso en avenida Nuestra Señora de Ujué, Tafalla","https://www.idealista.com/venta-viviendas/navarra/pagina-40.htm/inmueble/101532735/","190,000 €","3 hab. 108 m² Planta 2ª exterior con ascensor","Oportunidad muy interesante en Tafalla! Piso de 3 habitaciones, 2 baños, amplio salón-cocina, ascensor, garaje, trastero y terraza orientada a un espacio abierto (sin edificios que coarten su luminosi",""
"Navarra","Casa de pueblo en Carr. de los Valles Orientales de Navarra, s/n, Garaioa","https://www.idealista.com/venta-viviendas/navarra/pagina-40.htm/inmueble/99949652/","150,000 €","8 hab. 300 m²","Visita esta magnifica casa en el recorrido virtual. Garaioa forma parte del Valle de Aezkoa, enclavado en pleno Pirineo Oriental navarro, muy cerca de Roncesvalles, de la Selva de Irati y de las prime",""
"Navarra","Chalet en Antigua Carretera Pamplona-Medinaceli, Legarda","https://www.idealista.com/venta-viviendas/navarra/pagina-40.htm/inmueble/95889211/","173,000 €","6 hab. 393 m²","Estamos de suerte, en pleno camino de Santiago, en el pueblo de Legarda, en la autovía de Pamplona a Puente la Reina, presentamos una casa con solera, una casa antigua, grande con 6 dormitorios y much",""
"Navarra","Piso en calle de las Maestras, 4, Burlada","https://www.idealista.com/venta-viviendas/navarra/pagina-40.htm/inmueble/102118112/","159,000 €","3 hab. 91 m² Planta 5ª con ascensor","Ya sabes que vivir en Burlada es comodidad y tranquilidad. En el centro y muy cercana a la plaza de la iglesia y a todos los comercios se encuentra esta magnífica vivienda distribuida en 3 dormitorios",""
"Navarra","Piso en calle Aralar, 5, Irurtzun","https://www.idealista.com/venta-viviendas/navarra/pagina-40.htm/inmueble/101928823/","126,520 €","3 hab. 91 m² Planta 1ª exterior con ascensor","INMOBILIARIA AGURAIN vende un piso + local en calle Aralar de Irurtzun. Localidad a 20 kilómetros de Pamplona con todos los servicios a su alcance (supermercados, colegio, centro de salud, restaurante",""
"Navarra","Piso en Valle de Salazar, 5, Corella","https://www.idealista.com/venta-viviendas/navarra/pagina-40.htm/inmueble/95103221/","129,360 €","3 hab. 100 m² Planta 1ª exterior con ascensor","Piso de 100 m2, construido en el año 2008. Esta compuesto por un amplio salón, cocina (sin equipar) con tendedero, 3 dormitorios, 2 baños, uno de ellos en habitación principal, ascensor, garaje y tras",""
"Navarra","Chalet en calle Florida, Sansol","https://www.idealista.com/venta-viviendas/navarra/pagina-40.htm/inmueble/101004443/","105,000 €","4 hab. 242 m²","Sansol es una villa del municipio español de la comunidad de Navarra, situada en la merindad de Estella, a 67 km de la capital Navarra, de Pamplona.   Presentamos una vivienda en muy buen estado, y li",""
"Navarra","Piso en Monasterio Tulebras, 1, San Juan, Pamplona/Iruña","https://www.idealista.com/venta-viviendas/navarra/pagina-40.htm/inmueble/93790758/","662,000 €","3 hab. 205 m² Planta 3ª exterior con ascensor","ENGEL&VÖLKERS presenta espléndida vivienda en uno de los más exclusivos edificios de Pamplona. Con 204 m2 construidos y 175m2 útiles cuenta actualmente con 3 habitaciones y 2 baños, salón de 40 m2 y s",""
"Navarra","Piso en calle Emilio Arrieta, 14, 2º Ensanche, Pamplona/Iruña","https://www.idealista.com/venta-viviendas/navarra/pagina-40.htm/inmueble/89881925/","648,000 €","4 hab. 166 m² Planta 1ª exterior con ascensor","ENGEL&VÖLKERS Pamplona presenta esta magnífica vivienda de lujo de 166 m2 a estrenar, en la mejor zona del I Ensanche. Se puede acceder a través de dos entradas, la principal o la de servicio. Totalme",""
"Navarra","Dúplex en San Esteban, 3, Carcastillo","https://www.idealista.com/venta-viviendas/navarra/pagina-40.htm/inmueble/95141751/","85,921 €","2 hab. 88 m² Planta 2ª exterior con ascensor","Piso de 88 metros de superficie muy bien aprovechados. Esta distribuida en 2 dormitorios, 2 baños, cocina americana (sin montar), amplio salón con balcón, ascensor, garaje y trastero.. . y todo ello a",""
"Navarra","Piso en carretera Berbinzana, Larraga","https://www.idealista.com/venta-viviendas/navarra/pagina-40.htm/inmueble/101026863/","128,000 €","4 hab. 105 m² Bajo sin ascensor","En el centro del pueblo de Larraga, en Navarra, a 30 minutos de Pamplona, presentamos esta excelente oportunidad para aquellos que buscan  una vida tranquila y acogedora. Costa de 4 dormitorios, 1 ase",""
"Navarra","Casa o chalet independiente en avenida Nuestra Señora del Perdón, 18, Cizur","https://www.idealista.com/venta-viviendas/navarra/pagina-40.htm/inmueble/102312513/","239,900 €","3 hab. 176 m²","Casa en la mejor zona de Astrain al lado del frontón municipal, ofrecemos esta estupenda casa construida en el año 1.996 de 170 m2 construidos y 155 m2 útiles que se distribuye de esta forma: Planta b",""
"Navarra","Piso en paseo Sarasate, 22, Casco Antiguo, Pamplona/Iruña","https://www.idealista.com/venta-viviendas/navarra/pagina-40.htm/inmueble/98043921/","515,000 €","3 hab. 122 m² Planta 3ª exterior con ascensor","ENGEL&VÖLKERS Pamplona presenta precioso piso en el Paseo Sarasate de 122 m2, que se encuentra en un emplazamiento privilegiado del Casco Antiguo. Una tercera planta en edificio de 7 alturas, construi",""
"Navarra","Caserón en calle Barón de la Torre, 71, Cintruénigo","https://www.idealista.com/venta-viviendas/navarra/pagina-40.htm/inmueble/101454219/","159,900 €","5 hab. 400 m²","Oportunidad muy interesante en pleno centro de Cintruénigo. Vendemos casa Señorial para reformar ubicada en una espectacular parcela de casi 2000 metros que nos ofrecerá infinitas posibilidades, desde",""
"Navarra","Chalet adosado en urrutea, 8, Urzainqui","https://www.idealista.com/venta-viviendas/navarra/pagina-40.htm/inmueble/97217361/","98,000 €","2 hab. 145 m²","Venta de dos adosados de nueva construcción en Urzainqui, pueblo situado en el bonito valle del Roncal. El adosado se distribuye en tres plantas. La planta baja con constará de garaje y txoko. La prim",""
"Navarra","Piso en calle las Parras, 2, Mendigorria","https://www.idealista.com/venta-viviendas/navarra/pagina-40.htm/inmueble/92347407/","124,700 €","2 hab. 102 m² con ascensor","Piso de 2 dormitorios, 2 baños, garaje y trastero. Casi a estrenar, inmueble con ascensor,  y lo mejor de todo:  ¡si crees que su precio es otro haz tu propia oferta!  .",""
"Navarra","Piso en avenida Pío XII, 1, 1º Ensanche, Pamplona/Iruña","https://www.idealista.com/venta-viviendas/navarra/pagina-40.htm/inmueble/99459547/","245,000 €","1 hab. 60 m² Planta 6ª exterior con ascensor","En uno de los edificios más emblematicos de la ciudad, con portero, recién reformado con el portal, ascensores, fachada envolvente y el cambio de todas las ventanas, ponemos a la venta este piso en la",""
"Navarra","Casa o chalet independiente en calle Sān Pedro Kārrikā, 8, Baztan","https://www.idealista.com/venta-viviendas/navarra/pagina-40.htm/inmueble/100797672/","159,000 €","5 hab. 586 m²","Almandoz es la puerta de entrada al Valle desde el sur. Una situación privilegiada entre Pamplona y la frontera de Behobia, cada vez más cercanas con el desdoblamiento de la Nacional 121. Es el más al",""
"Navarra","Casa o chalet independiente en Pantano, 8, Yerri","https://www.idealista.com/venta-viviendas/navarra/pagina-40.htm/inmueble/84359855/","275,000 €","5 hab. 400 m²","El inmueble que les presentamos se encuentra en Úgar valle de Yerri. Muy cerca de un de los lugares de ocio más activos de Navarra: El embalse de Alloz. Se trata de un caserón reformado que consta de",""
"Navarra","Piso en Pío XII Etorbidea, 26, Iturrama, Pamplona/Iruña","https://www.idealista.com/venta-viviendas/navarra/pagina-40.htm/inmueble/98945535/","513,000 €","4 hab. 150 m² Planta 3ª exterior con ascensor","ENGEL&VÖLKERS Pamplona presenta una confortable y amplia vivienda de 140 m2 situada en la tercera planta de un lujoso edificio en una de las principales avenidas de Pamplona, Pio XII. Sus vistas despe",""
"Navarra","Piso en Peralta","https://www.idealista.com/venta-viviendas/navarra/pagina-40.htm/inmueble/101150855/","169,000 €","3 hab. 139 m² Planta 2ª con ascensor","VIvienda luminosa y acogedorra en Peralta, con espacios amplios y una excelente distribución. El piso se compone de 3 habitaciones, 2 baños, cocina, sala de estar, despensa y vestidor.  Además la  viv",""
"Navarra","Piso en Errotazar, 23, Rochapea, Pamplona/Iruña","https://www.idealista.com/venta-viviendas/navarra/pagina-40.htm/inmueble/98423407/","220,000 €","3 hab. 150 m² Bajo exterior sin ascensor","A&P inmobiliaria vende última VIVIENDA NUEVA a ESTRENAR en Pamplona, Barrio de la Rochapea, calle Errotazar. Tiene 150 m² y 131 m² útiles. Consta de Salón-comedor con cocina americana de 47 m² y salid",""
"Navarra","Chalet en Egüés","https://www.idealista.com/venta-viviendas/navarra/pagina-40.htm/inmueble/90260259/","871,300 €","15 hab. 3.100 m²","¿Tienes nuevos proyectos para comenzar un negocio en un lugar único? ¿Un parador? ¿Un lugar de formación? ¿Viviendas?   Eransus, lugar singular y antiguo señorío del valle y municipio de Egüés, en la",""
"Navarra","Piso en calle Etxaburua, Berriozar","https://www.idealista.com/venta-viviendas/navarra/pagina-40.htm/inmueble/101651700/","192,000 €","3 hab. 103 m² Planta 1ª exterior con ascensor","- BERRIOZAR - L & J ofrece en VENTA este estupendo piso de 103 m2. Consta de Hall, cocina equipada completa + despensa con tendedero, salón con salida a terraza, 3 habitaciones, 2 baños, armarios empo",""
"Navarra","Casa o chalet independiente en travesía Heras, 1, Berrioplano","https://www.idealista.com/venta-viviendas/navarra/pagina-40.htm/inmueble/100915753/","649,000 €","4 hab. 334 m²","Este magnífico chalet en Berrioplano aúna espacio, comodidad y estética. Está en la mejor ubicación rodeada de todos los servicios disponibles, junto al ayuntamiento, las piscinas y zona deportiva, el",""
"Navarra","Casa o chalet independiente en Pantano, 8, Yerri","https://www.idealista.com/venta-viviendas/navarra/pagina-41.htm/inmueble/84359855/","275,000 €","5 hab. 400 m²","El inmueble que les presentamos se encuentra en Úgar valle de Yerri. Muy cerca de un de los lugares de ocio más activos de Navarra: El embalse de Alloz. Se trata de un caserón reformado que consta de",""
"Navarra","Casa o chalet independiente en calle Zubiarte, 43, Huarte","https://www.idealista.com/venta-viviendas/navarra/pagina-41.htm/inmueble/101652273/","349,000 €","5 hab. 260 m²","Esta es una oportunidad irrepetibe. Por el precio de un piso, ahora puedes vivir en una impresionante casa en Huarte. En el centro de la localidad cerca de todos los servicios y comercios necesarios p",""
"Navarra","Piso en avenida de Severino Fernandez Ibilbidea, Tafalla","https://www.idealista.com/venta-viviendas/navarra/pagina-41.htm/inmueble/87901549/","91,000 €","8 hab. 168 m² Planta 1ª con ascensor","Céntrica vivienda para reformar en Tafalla, Navarra a tan sólo 250 metros del Ayuntamiento de la localidad. Formado por la unión de 2 viviendas. Suman un total de 438 m². Localizado en zona residencia",""
"Navarra","Chalet adosado en calle Goienkale, Olazti/Olazagutia","https://www.idealista.com/venta-viviendas/navarra/pagina-41.htm/inmueble/102307240/","127,950 €","2 hab. 68 m²","INMOBILIARIA AGURAIN vende casa adosada en Olazti/Olazagutia. Población cercana a Alsasua, en la intersección de Vitoria-San Sebastián-Pamplona, rodeada de naturaleza y con todos los servicios a tu al",""
"Navarra","Piso en Peralta","https://www.idealista.com/venta-viviendas/navarra/pagina-41.htm/inmueble/101150855/","169,000 €","3 hab. 139 m² Planta 2ª con ascensor","VIvienda luminosa y acogedorra en Peralta, con espacios amplios y una excelente distribución. El piso se compone de 3 habitaciones, 2 baños, cocina, sala de estar, despensa y vestidor.  Además la  viv",""
"Navarra","Casa de pueblo en Eliza Bidea, Labaien","https://www.idealista.com/venta-viviendas/navarra/pagina-41.htm/inmueble/96259517/","66,000 €","5 hab. 593 m²","Si eres de los que sabes sacarle partido a las cosas.. . Caserón típico de la zona con 593m2 para poner a tu gusto completamente! Situado en el centro del pueblo de Beintza Labaien y rodeado de natura",""
"Navarra","Casa o chalet independiente en calle Sān Pedro Kārrikā, 8, Baztan","https://www.idealista.com/venta-viviendas/navarra/pagina-41.htm/inmueble/100797672/","159,000 €","5 hab. 586 m²","Almandoz es la puerta de entrada al Valle desde el sur. Una situación privilegiada entre Pamplona y la frontera de Behobia, cada vez más cercanas con el desdoblamiento de la Nacional 121. Es el más al",""
"Navarra","Casa o chalet independiente en travesía Heras, 1, Berrioplano","https://www.idealista.com/venta-viviendas/navarra/pagina-41.htm/inmueble/100915753/","649,000 €","4 hab. 334 m²","Este magnífico chalet en Berrioplano aúna espacio, comodidad y estética. Está en la mejor ubicación rodeada de todos los servicios disponibles, junto al ayuntamiento, las piscinas y zona deportiva, el",""
"Navarra","Piso en avenida Pío XII, 1, 1º Ensanche, Pamplona/Iruña","https://www.idealista.com/venta-viviendas/navarra/pagina-41.htm/inmueble/99459547/","245,000 €","1 hab. 60 m² Planta 6ª exterior con ascensor","En uno de los edificios más emblematicos de la ciudad, con portero, recién reformado con el portal, ascensores, fachada envolvente y el cambio de todas las ventanas, ponemos a la venta este piso en la",""
"Navarra","Chalet en calle Bizkain, Etxarri-Aranatz","https://www.idealista.com/venta-viviendas/navarra/pagina-41.htm/inmueble/100413900/","97,000 €","2 hab. 186 m²","Etxarri Aranatz es uno de los pueblos más importantes de la barranca, por su situación, lo tenemos cerca de tierra Estella, Vitoria y Pamplona. En este pueblo, presentamos una preciosa vivienda biocli",""
"Navarra","Piso en Egüés","https://www.idealista.com/venta-viviendas/navarra/pagina-41.htm/inmueble/101550033/","192,900 €","3 hab. 108 m² Planta 1ª exterior con ascensor","Vivienda V. P. O. en Sarriguren de tres habitaciones y dos baños incluido garaje y trastero. Totalmente exterior, muy luminoso con todo lo necesario para que vivas de manera cómoda y con un estilo de",""
"Navarra","Casa o chalet independiente en Juslapeña","https://www.idealista.com/venta-viviendas/navarra/pagina-41.htm/inmueble/101909194/","795,000 €","5 hab. 550 m²","En la hermosa localidad de Marcaláin en el municipio de Julaspeña ubicado a tan solo 12 kilómetros de Pamplona, se encuentra disponible una Espectacular Casa, ideal para aquellos que buscan un espacio",""
"Navarra","Piso en caemen baroja nessi, 16, Rochapea, Pamplona/Iruña","https://www.idealista.com/venta-viviendas/navarra/pagina-41.htm/inmueble/100172964/","220,000 €","3 hab. 137 m² Bajo exterior sin ascensor","¿Te gustaría tener el privilegio de estrenar un precioso loft totalmente nuevo, con baños totalmente equipados? Si es así, estás has dado con el indicado. Ven a conocer esta vivienda en la mejor zona",""
"Navarra","Casa o chalet independiente en calle Errekaldea, 7, Olaibar","https://www.idealista.com/venta-viviendas/navarra/pagina-41.htm/inmueble/97826204/","430,000 €","4 hab. 336 m²","A 10 minutos de Pamplona, en la localidad de Endériz y asentada sobre un solar de 740 m², encontramos esta gran y bien construida vivienda moderna del año 2004 y de 467 m² construidos distribuidos en",""
"Navarra","Casa o chalet independiente en Arakil","https://www.idealista.com/venta-viviendas/navarra/pagina-41.htm/inmueble/97262148/","590,000 €","8 hab. 528 m²","CaSA RURAL 8h CON ASCENSOR, 1000 m de JARDÍN A 15\' de Pamplona.     La propiedad es un LUJO en plena naturaleza. El pueblo de Izurdiaga está situado a 22 km. de Pamplona y junto a la autovía que cone",""
"Navarra","Piso en calle Francisco Bergamín, 43, 2º Ensanche, Pamplona/Iruña","https://www.idealista.com/venta-viviendas/navarra/pagina-41.htm/inmueble/102221734/","314,000 €","2 hab. 103 m² Planta 1ª exterior con ascensor","POSEM presenta Bergamín Collection 43: 24 exclusivas viviendas de 1, 2 y 3 dormitorios, áticos y primeros con patio, en el Segundo Ensanche. Te presentamos un nuevo concepto de vivienda en pleno coraz",""
"Navarra","Piso en avenida Argentina, 1, Centro, Tudela","https://www.idealista.com/venta-viviendas/navarra/pagina-41.htm/inmueble/102032968/","170,000 €","3 hab. 85 m² Planta 3ª exterior con ascensor","Piso de obra nueva recién construido y situado en avenida Argentina 1 de Tudela, a solo 5 minutos caminando de la Plaza de los Fueros. Se trata de una vivienda de 85 metros cuadrados construidos, en p",""
"Navarra","Chalet en Yerri","https://www.idealista.com/venta-viviendas/navarra/pagina-41.htm/inmueble/99385674/","25,000 €","3 hab. 249 m²","¡OPORTUNIDAD EN ARIZALETA!   A 15 minutos de Estella y a 35 de Pamplona se encuentra éste tranquilo y bonito pueblo en la zona norte del Valle de Yerri. Se trata de un inmueble de construcción tradici",""
"Navarra","Piso en carretera Jaca, 6, Noáin (Valle de Elorz)","https://www.idealista.com/venta-viviendas/navarra/pagina-41.htm/inmueble/99861050/","140,000 €","3 hab. 82 m² Planta 3ª exterior sin ascensor","Esta vivienda tiene unas vistas espetaculares, todos los servicios cerca, tres amplios y luminosos dormitorios, una cocina grande,  independiente y luminosa con preciosas vistas, despensa,  baño con v",""
"Navarra","Piso en calle Francisco Bergamín, 43, 2º Ensanche, Pamplona/Iruña","https://www.idealista.com/venta-viviendas/navarra/pagina-41.htm/inmueble/102221723/","329,000 €","2 hab. 82 m² Planta 5ª exterior con ascensor","POSEM presenta Bergamín Collection 43: 24 exclusivas viviendas de 1, 2 y 3 dormitorios, áticos y primeros con patio, en el Segundo Ensanche. Te presentamos un nuevo concepto de vivienda en pleno coraz",""
"Navarra","Piso en plaza Sancho VI el Sabio, 7, Villava","https://www.idealista.com/venta-viviendas/navarra/pagina-41.htm/inmueble/101077399/","197,000 €","4 hab. 107 m² Planta 8ª exterior con ascensor","¿Quieres diseñar el hogar de tus sueños en Villava? ¿Buscas espacio, luz y vistas? ¡Continúa leyendo y descubre las características de tu nueva casa! Hablamos de un octavo piso en la plaza Sancho VI c",""
"Navarra","Casa o chalet independiente en A-15, 224, Arakil","https://www.idealista.com/venta-viviendas/navarra/pagina-41.htm/inmueble/99644102/","775,000 €","8 hab. 1.141 m²","Esta bonita finca navarra se encuentra junto al pueblo de Irurzun, en el cauce del río Larraun, muy próximo a las altas masas pétreas llamadas Dos Hermanas. En este pueblo se cruzan las autopistas Pam",""
"Navarra","Dúplex en calle Mayor, 16, Puente la Reina","https://www.idealista.com/venta-viviendas/navarra/pagina-41.htm/inmueble/102074600/","96,000 €","1 hab. 77 m² Planta 3ª exterior sin ascensor","Coqueto apartamento ático-dúplex en pleno centro de Puente la Reina. Ideal para inversores, parejas o persona sola. El piso cuenta con 53,71 m. útiles y es muy luminoso, debido a su orientación sur co",""
"Navarra","Casa o chalet independiente en calle Iturbide, 7, Iza","https://www.idealista.com/venta-viviendas/navarra/pagina-41.htm/inmueble/101496158/","449,000 €","3 hab. 275 m²","POSIBILIDAD DE VENTA APLAZADA ENTREGANDO EL 10% Y MESUALIDADES A DESCONTAR DEL PRECIO INTEGRAS! ESTE EXCLUSIVO Y ÚNICO UNIFAMILIAR TE VA A SORPRENDER! En el Valle de Iza y en un pueblecito llamado Ald",""
"Navarra","Piso en calle Uriz, 12, Lakuntza","https://www.idealista.com/venta-viviendas/navarra/pagina-41.htm/inmueble/96867013/","85,000 €","4 hab. 126 m² Planta 2ª exterior sin ascensor","Amplio piso, muy luminoso y con excelentes vistas, situado en Lakuntza, en el valle de Aranaz, entre las sierras de Aralar y Andia, a unos 36 km de Pamplona. Muy bien comunicado por autovía con Pamplo",""
"Navarra","Chalet pareado en La Arboleda, 15, Cizur","https://www.idealista.com/venta-viviendas/navarra/pagina-41.htm/inmueble/100958626/","390,000 €","4 hab. 224 m²","Si disfrutas de la amplitud y la tranquilidad, esta es la casa que estas buscando. Te ofrecemos este espectacular pareado en Zariquiegui a 5 minutos de Zizur y a 11 km de Pamplona. La casa tiene unas",""
"Navarra","Piso en plaza Sancho VI el Sabio, 7, Villava","https://www.idealista.com/venta-viviendas/navarra/pagina-41.htm/inmueble/101077389/","220,000 €","4 hab. 107 m² Planta 8ª exterior con ascensor","¡Te traemos un fantástico piso libre en Villava con las vistas que siempre soñaste y todo el espacio que puedas desear! Este piso es un lienzo en blanco con espacio, luz y terraza, ¿quieres saber más?",""
"Navarra","Chalet adosado en calle la Cinta, 6, Caseda","https://www.idealista.com/venta-viviendas/navarra/pagina-41.htm/inmueble/97348820/","87,000 €","3 hab. 135 m²","Consta de una entrada con escaleras para acceder a los 3 pisos preparados como vivienda y puerta con acceso a escaleras para bajar a 2 plantas diáfanas con ventana y una 3ª bodega, con acceso a un pos",""
"Navarra","Piso en calle Francisco Bergamín, 43, 2º Ensanche, Pamplona/Iruña","https://www.idealista.com/venta-viviendas/navarra/pagina-41.htm/inmueble/102221735/","314,000 €","2 hab. 82 m² Planta 2ª exterior con ascensor","POSEM presenta Bergamín Collection 43: 24 exclusivas viviendas de 1, 2 y 3 dormitorios, áticos y primeros con patio, en el Segundo Ensanche. Te presentamos un nuevo concepto de vivienda en pleno coraz",""
"Navarra","Chalet en calle la Cinta, 16, Caseda","https://www.idealista.com/venta-viviendas/navarra/pagina-41.htm/inmueble/100446135/","185,000 €","7 hab. 255 m²","¿Te imaginas vivir en una casa señorial de la época medieval? Una casa donde puedas cambiar de época solo cambiando de planta. Te presentamos esta gran casa señorial en el pueblo de Cáseda cuya constr",""
"Navarra","Piso en calle Errotaxar Kalea, 2, Zizur Mayor/Zizur Nagusia","https://www.idealista.com/venta-viviendas/navarra/pagina-42.htm/inmueble/101379002/","185,000 €","1 hab. 50 m² Planta 2ª exterior con ascensor","SOLEADO apartamento, construído en 2009 por Construcciones ANDÍA.   SEGUNDA altura en ESQUINA con VISTAS y excelentes acabados tanto en interior como en exterior. Como podrá apreciar en el plano, el a","Apartamento"
"Navarra","Piso en avenida Argentina, 1, Centro, Tudela","https://www.idealista.com/venta-viviendas/navarra/pagina-42.htm/inmueble/102032968/","170,000 €","3 hab. 85 m² Planta 3ª exterior con ascensor","Piso de obra nueva recién construido y situado en avenida Argentina 1 de Tudela, a solo 5 minutos caminando de la Plaza de los Fueros. Se trata de una vivienda de 85 metros cuadrados construidos, en p",""
"Navarra","Piso en calle Hermanos Noain, 36, Ansoain","https://www.idealista.com/venta-viviendas/navarra/pagina-42.htm/inmueble/101718500/","170,000 €","3 hab. 98 m² Planta 1ª exterior sin ascensor","Se vende piso en Ansoáin de 91 metros cuadrados. Una de las principales características de esta propiedad es su distribución, que consta de 3 habitaciones, lo que la convierte en una opción ideal para",""
"Navarra","Chalet en ronda San Cristóbal, 99, Zizur Mayor/Zizur Nagusia","https://www.idealista.com/venta-viviendas/navarra/pagina-42.htm/inmueble/100887837/","549,000 €","4 hab. 280 m²","¡Bienvenidos a la oportunidad de adquirir el chalet de tus sueños en Zizur Mayor! Este hermoso chalet de 740 metros de parcela es el hogar perfecto para aquellos que buscan una vida tranquila y cómoda",""
"Navarra","Piso en calle Francisco Bergamín, 43, 2º Ensanche, Pamplona/Iruña","https://www.idealista.com/venta-viviendas/navarra/pagina-42.htm/inmueble/102221735/","314,000 €","2 hab. 82 m² Planta 2ª exterior con ascensor","POSEM presenta Bergamín Collection 43: 24 exclusivas viviendas de 1, 2 y 3 dormitorios, áticos y primeros con patio, en el Segundo Ensanche. Te presentamos un nuevo concepto de vivienda en pleno coraz",""
